card_id,card_type,card_name,description,flavor_text,target,scope,phase_restriction,space_restriction,work_type_restriction,immediate_effect,duration,duration_count,turn_effect,money_cost,money_effect,percentage_effect,time_effect,tick_modifier,dice_trigger,dice_effect,conditional_logic,draw_cards,discard_cards,card_type_filter,movement_effect,space_effect,inspection_effect,player_state_check,game_state_check,stacking_limit,usage_limit,cooldown,combo_requirement,prerequisite,priority,queue_effect,loan_amount,loan_rate,investment_amount,work_cost,activation_timing,chain_effect,nullify_effect,environmental_factor,social_factor,political_factor,rarity,distribution_level,,
W057,W,Installation of pre-action sprinkler system in museum exhibit hall,Installation of pre-action sprinkler system in museum exhibit hall,,Self,Single,Any,,Sprinklers,Apply Work,Permanent,,,,,,,,,,,,,,,,,,,1,1,,,,,,,,,220000,Immediate,,,,,,Common,Low,,
W058,W,New sprinkler system for high-pile storage warehouse,New sprinkler system for high-pile storage warehouse,,Self,Single,Any,,Sprinklers,Apply Work,Permanent,,,,,,,,,,,,,,,,,,,1,1,,,,,,,,,500000,Immediate,,,,,,Common,Low,,
W059,W,Retrofit of sprinkler system in parking garage,Retrofit of sprinkler system in parking garage,,Self,Single,Any,,Sprinklers,Apply Work,Permanent,,,,,,,,,,,,,,,,,,,1,1,,,,,,,,,160000,Immediate,,,,,,Common,Low,,
W060,W,Seismic retrofit of unreinforced masonry building,Seismic retrofit of unreinforced masonry building,,Self,Single,Any,,Structural,Apply Work,Permanent,,,,,,,,,,,,,,,,,,,1,1,,,,,,,,,800000,Immediate,,,,,,Common,Low,,
W061,W,Installation of tuned mass damper in slender high-rise building,Installation of tuned mass damper in slender high-rise building,,Self,Single,Any,,Structural,Apply Work,Permanent,,,,,,,,,,,,,,,,,,,1,1,,,,,,,,,1500000,Immediate,,,,,,Common,Low,,
W062,W,Structural reinforcement for rooftop helipad on hospital,Structural reinforcement for rooftop helipad on hospital,,Self,Single,Any,,Structural,Apply Work,Permanent,,,,,,,,,,,,,,,,,,,1,1,,,,,,,,,600000,Immediate,,,,,,Common,Low,,
W063,W,Carbon fiber reinforcement of concrete beams in parking structure,Carbon fiber reinforcement of concrete beams in parking structure,,Self,Single,Any,,Structural,Apply Work,Permanent,,,,,,,,,,,,,,,,,,,1,1,,,,,,,,,250000,Immediate,,,,,,Common,Low,,
W064,W,Foundation stabilization using helical piers for settling historic building,Foundation stabilization using helical piers for settling historic building,,Self,Single,Any,,Structural,Apply Work,Permanent,,,,,,,,,,,,,,,,,,,1,1,,,,,,,,,180000,Immediate,,,,,,Common,Low,,
W065,W,Structural modifications to accommodate new atrium in office building,Structural modifications to accommodate new atrium in office building,,Self,Single,Any,,Structural,Apply Work,Permanent,,,,,,,,,,,,,,,,,,,1,1,,,,,,,,,400000,Immediate,,,,,,Common,Low,,
W066,W,Strengthening of bridge structure for increased load capacity,Strengthening of bridge structure for increased load capacity,,Self,Single,Any,,Structural,Apply Work,Permanent,,,,,,,,,,,,,,,,,,,1,1,,,,,,,,,1200000,Immediate,,,,,,Common,Low,,
W067,W,Installation of moment frames for open floor plan in retail space,Installation of moment frames for open floor plan in retail space,,Self,Single,Any,,Structural,Apply Work,Permanent,,,,,,,,,,,,,,,,,,,1,1,,,,,,,,,150000,Immediate,,,,,,Common,Low,,
W068,W,Installation of branded construction fence with public art for museum expansion,Installation of branded construction fence with public art for museum expansion,,Self,Single,Any,,Construction Fence,Apply Work,Permanent,,,,,,,,,,,,,,,,,,,1,1,,,,,,,,,40000,Immediate,,,,,,Common,Low,,
W069,W,Noise-reducing acoustic fence for urban construction site,Noise-reducing acoustic fence for urban construction site,,Self,Single,Any,,Construction Fence,Apply Work,Permanent,,,,,,,,,,,,,,,,,,,1,1,,,,,,,,,55000,Immediate,,,,,,Common,Low,,
W070,W,Temporary fence with integrated security cameras for high-security project,Temporary fence with integrated security cameras for high-security project,,Self,Single,Any,,Construction Fence,Apply Work,Permanent,,,,,,,,,,,,,,,,,,,1,1,,,,,,,,,75000,Immediate,,,,,,Common,Low,,
W071,W,Installation of living green construction fence for eco-friendly development,Installation of living green construction fence for eco-friendly development,,Self,Single,Any,,Construction Fence,Apply Work,Permanent,,,,,,,,,,,,,,,,,,,1,1,,,,,,,,,45000,Immediate,,,,,,Common,Low,,
W072,W,Modular reusable fencing system for multi-phase campus construction,Modular reusable fencing system for multi-phase campus construction,,Self,Single,Any,,Construction Fence,Apply Work,Permanent,,,,,,,,,,,,,,,,,,,1,1,,,,,,,,,90000,Immediate,,,,,,Common,Low,,
W073,W,Wind-resistant fencing for high-rise construction in coastal area,Wind-resistant fencing for high-rise construction in coastal area,,Self,Single,Any,,Construction Fence,Apply Work,Permanent,,,,,,,,,,,,,,,,,,,1,1,,,,,,,,,65000,Immediate,,,,,,Common,Low,,
W074,W,Custom-designed construction fence for high-profile urban project,Custom-designed construction fence for high-profile urban project,,Self,Single,Any,,Construction Fence,Apply Work,Permanent,,,,,,,,,,,,,,,,,,,1,1,,,,,,,,,80000,Immediate,,,,,,Common,Low,,
W075,W,Installation of sidewalk shed with solar-powered lighting for long-term project,Installation of sidewalk shed with solar-powered lighting for long-term project,,Self,Single,Any,,Sidewalk Shed,Apply Work,Permanent,,,,,,,,,,,,,,,,,,,1,1,,,,,,,,,85000,Immediate,,,,,,Common,Low,,
W076,W,Heavy-duty sidewalk shed for demolition of 30-story building,Heavy-duty sidewalk shed for demolition of 30-story building,,Self,Single,Any,,Sidewalk Shed,Apply Work,Permanent,,,,,,,,,,,,,,,,,,,1,1,,,,,,,,,200000,Immediate,,,,,,Common,Low,,
W077,W,Sidewalk shed with heat tracing for winter construction project,Sidewalk shed with heat tracing for winter construction project,,Self,Single,Any,,Sidewalk Shed,Apply Work,Permanent,,,,,,,,,,,,,,,,,,,1,1,,,,,,,,,110000,Immediate,,,,,,Common,Low,,
W078,W,Custom-designed sidewalk shed to maintain retail visibility during construction,Custom-designed sidewalk shed to maintain retail visibility during construction,,Self,Single,Any,,Sidewalk Shed,Apply Work,Permanent,,,,,,,,,,,,,,,,,,,1,1,,,,,,,,,95000,Immediate,,,,,,Common,Low,,
W079,W,Sidewalk shed with integrated public art installation,Sidewalk shed with integrated public art installation,,Self,Single,Any,,Sidewalk Shed,Apply Work,Permanent,,,,,,,,,,,,,,,,,,,1,1,,,,,,,,,70000,Immediate,,,,,,Common,Low,,
W080,W,High-capacity sidewalk shed for major facade restoration project,High-capacity sidewalk shed for major facade restoration project,,Self,Single,Any,,Sidewalk Shed,Apply Work,Permanent,,,,,,,,,,,,,,,,,,,1,1,,,,,,,,,150000,Immediate,,,,,,Common,Low,,
W081,W,Installation of suspended scaffold system for bridge maintenance,Installation of suspended scaffold system for bridge maintenance,,Self,Single,Any,,Supported Scaffold,Apply Work,Permanent,,,,,,,,,,,,,,,,,,,1,1,,,,,,,,,120000,Immediate,,,,,,Common,Low,,
W082,W,Multi-point suspended scaffold for high-rise window replacement,Multi-point suspended scaffold for high-rise window replacement,,Self,Single,Any,,Supported Scaffold,Apply Work,Permanent,,,,,,,,,,,,,,,,,,,1,1,,,,,,,,,180000,Immediate,,,,,,Common,Low,,
W083,W,Cantilever scaffold system for overhanging structure renovation,Cantilever scaffold system for overhanging structure renovation,,Self,Single,Any,,Supported Scaffold,Apply Work,Permanent,,,,,,,,,,,,,,,,,,,1,1,,,,,,,,,95000,Immediate,,,,,,Common,Low,,
W084,W,Interior scaffold system for cathedral ceiling restoration,Interior scaffold system for cathedral ceiling restoration,,Self,Single,Any,,Supported Scaffold,Apply Work,Permanent,,,,,,,,,,,,,,,,,,,1,1,,,,,,,,,85000,Immediate,,,,,,Common,Low,,
W085,W,Scaffold system with debris netting for facade cleaning project,Scaffold system with debris netting for facade cleaning project,,Self,Single,Any,,Supported Scaffold,Apply Work,Permanent,,,,,,,,,,,,,,,,,,,1,1,,,,,,,,,70000,Immediate,,,,,,Common,Low,,
W086,W,Installation of 5G small cell antennas on utility poles throughout downtown,Installation of 5G small cell antennas on utility poles throughout downtown,,Self,Single,Any,,Antenna,Apply Work,Permanent,,,,,,,,,,,,,,,,,,,1,1,,,,,,,,,200000,Immediate,,,,,,Common,Low,,
W087,W,Upgrade of television broadcast antenna on skyscraper,Upgrade of television broadcast antenna on skyscraper,,Self,Single,Any,,Antenna,Apply Work,Permanent,,,,,,,,,,,,,,,,,,,1,1,,,,,,,,,350000,Immediate,,,,,,Common,Low,,
W088,W,New rooftop cellular antenna array for improved coverage in suburban area,New rooftop cellular antenna array for improved coverage in suburban area,,Self,Single,Any,,Antenna,Apply Work,Permanent,,,,,,,,,,,,,,,,,,,1,1,,,,,,,,,120000,Immediate,,,,,,Common,Low,,
W089,W,Installation of long-range Wi-Fi antennas for rural broadband project,Installation of long-range Wi-Fi antennas for rural broadband project,,Self,Single,Any,,Antenna,Apply Work,Permanent,,,,,,,,,,,,,,,,,,,1,1,,,,,,,,,180000,Immediate,,,,,,Common,Low,,
W090,W,Replacement of coal-fired boiler with high-efficiency natural gas system,Replacement of coal-fired boiler with high-efficiency natural gas system,,Self,Single,Any,,Boiler Equipment,Apply Work,Permanent,,,,,,,,,,,,,,,,,,,1,1,,,,,,,,,600000,Immediate,,,,,,Common,Low,,
W091,W,Installation of biomass boiler for district heating system,Installation of biomass boiler for district heating system,,Self,Single,Any,,Boiler Equipment,Apply Work,Permanent,,,,,,,,,,,,,,,,,,,1,1,,,,,,,,,800000,Immediate,,,,,,Common,Low,,
W092,W,Upgrade of industrial boiler to meet new emissions standards,Upgrade of industrial boiler to meet new emissions standards,,Self,Single,Any,,Boiler Equipment,Apply Work,Permanent,,,,,,,,,,,,,,,,,,,1,1,,,,,,,,,450000,Immediate,,,,,,Common,Low,,
W093,W,Installation of condensing boilers for large office complex,Installation of condensing boilers for large office complex,,Self,Single,Any,,Boiler Equipment,Apply Work,Permanent,,,,,,,,,,,,,,,,,,,1,1,,,,,,,,,350000,Immediate,,,,,,Common,Low,,
W094,W,Design and installation of digital billboard on highway,Design and installation of digital billboard on highway,,Self,Single,Any,,Sign,Apply Work,Permanent,,,,,,,,,,,,,,,,,,,1,1,,,,,,,,,250000,Immediate,,,,,,Common,Low,,
W095,W,Custom neon sign creation for historic theater restoration,Custom neon sign creation for historic theater restoration,,Self,Single,Any,,Sign,Apply Work,Permanent,,,,,,,,,,,,,,,,,,,1,1,,,,,,,,,75000,Immediate,,,,,,Common,Low,,
W096,W,Installation of wayfinding signage system for university campus,Installation of wayfinding signage system for university campus,,Self,Single,Any,,Sign,Apply Work,Permanent,,,,,,,,,,,,,,,,,,,1,1,,,,,,,,,120000,Immediate,,,,,,Common,Low,,
W097,W,Large-scale solar array installation for shopping center,Large-scale solar array installation for shopping center,,Self,Single,Any,,Solar,Apply Work,Permanent,,,,,,,,,,,,,,,,,,,1,1,,,,,,,,,500000,Immediate,,,,,,Common,Low,,
W098,W,Integrated solar roof tiles for new residential development,Integrated solar roof tiles for new residential development,,Self,Single,Any,,Solar,Apply Work,Permanent,,,,,,,,,,,,,,,,,,,1,1,,,,,,,,,350000,Immediate,,,,,,Common,Low,,
W099,W,Installation of new standpipe system in high-rise residential building,Installation of new standpipe system in high-rise residential building,,Self,Single,Any,,Standpipe,Apply Work,Permanent,,,,,,,,,,,,,,,,,,,1,1,,,,,,,,,280000,Immediate,,,,,,Common,Low,,
W100,W,Installation of hydraulic shores for deep excavation support,Installation of hydraulic shores for deep excavation support,,Self,Single,Any,,Protection and Mechanical Methods,Apply Work,Permanent,,,,,,,,,,,,,,,,,,,1,1,,,,,,,,,80000,Immediate,,,,,,Common,Low,,
W101,W,Creation of ADA-compliant curb cut with tactile warning surface,Creation of ADA-compliant curb cut with tactile warning surface,,Self,Single,Any,,Curb Cut,Apply Work,Permanent,,,,,,,,,,,,,,,,,,,1,1,,,,,,,,,18000,Immediate,,,,,,Common,Low,,
W102,W,Site preparation and terracing for hillside vineyard development,Site preparation and terracing for hillside vineyard development,,Self,Single,Any,,Earth Work,Apply Work,Permanent,,,,,,,,,,,,,,,,,,,1,1,,,,,,,,,95000,Immediate,,,,,,Common,Low,,
W103,W,Implosion of obsolete 20-story office tower in urban center,Implosion of obsolete 20-story office tower in urban center,,Self,Single,Any,,Full Demolition,Apply Work,Permanent,,,,,,,,,,,,,,,,,,,1,1,,,,,,,,,1500000,Immediate,,,,,,Common,Low,,
W104,W,Installation of secant pile wall for below-grade parking structure,Installation of secant pile wall for below-grade parking structure,,Self,Single,Any,,Support of Excavation,Apply Work,Permanent,,,,,,,,,,,,,,,,,,,1,1,,,,,,,,,450000,Immediate,,,,,,Common,Low,,
W105,W,Construction of mat foundation for new wind turbine,Construction of mat foundation for new wind turbine,,Self,Single,Any,,Foundation,Apply Work,Permanent,,,,,,,,,,,,,,,,,,,1,1,,,,,,,,,750000,Immediate,,,,,,Common,Low,,
W106,W,Conversion of former industrial loft into co-working space,Conversion of former industrial loft into co-working space,,Self,Single,Any,,Alteration,Apply Work,Permanent,,,,,,,,,,,,,,,,,,,1,1,,,,,,,,,280000,Immediate,,,,,,Common,Low,,
W107,W,Installation of FM-200 fire suppression system in server room,Installation of FM-200 fire suppression system in server room,,Self,Single,Any,,Fire Suppression,Apply Work,Permanent,,,,,,,,,,,,,,,,,,,1,1,,,,,,,,,85000,Immediate,,,,,,Common,Low,,
W108,W,Surgical demolition of interior for historical building adaptive reuse,Surgical demolition of interior for historical building adaptive reuse,,Self,Single,Any,,Demolition & Removal,Apply Work,Permanent,,,,,,,,,,,,,,,,,,,1,1,,,,,,,,,110000,Immediate,,,,,,Common,Low,,
W109,W,Installation of biodiesel fuel storage and dispensing system for fleet vehicles,Installation of biodiesel fuel storage and dispensing system for fleet vehicles,,Self,Single,Any,,Fuel Storage,Apply Work,Permanent,,,,,,,,,,,,,,,,,,,1,1,,,,,,,,,95000,Immediate,,,,,,Common,Low,,
W110,W,Implementation of smart grid technology for university campus,Implementation of smart grid technology for university campus,,Self,Single,Any,,Electrical,Apply Work,Permanent,,,,,,,,,,,,,,,,,,,1,1,,,,,,,,,500000,Immediate,,,,,,Common,Low,,
W111,W,Setup of gantry crane system for precast concrete installation,Setup of gantry crane system for precast concrete installation,,Self,Single,Any,,Construction Equipment,Apply Work,Permanent,,,,,,,,,,,,,,,,,,,1,1,,,,,,,,,350000,Immediate,,,,,,Common,Low,,
W112,W,Installation of automated waste sorting and recycling chute system,Installation of automated waste sorting and recycling chute system,,Self,Single,Any,,Chute,Apply Work,Permanent,,,,,,,,,,,,,,,,,,,1,1,,,,,,,,,70000,Immediate,,,,,,Common,Low,,
W113,W,Installation of wildlife exclusion fence for airport runway,Installation of wildlife exclusion fence for airport runway,,Self,Single,Any,,Fence,Apply Work,Permanent,,,,,,,,,,,,,,,,,,,1,1,,,,,,,,,120000,Immediate,,,,,,Common,Low,,
W114,W,Creation of artificial wetland for stormwater management,Creation of artificial wetland for stormwater management,,Self,Single,Any,,Earthwork Only,Apply Work,Permanent,,,,,,,,,,,,,,,,,,,1,1,,,,,,,,,180000,Immediate,,,,,,Common,Low,,
W115,W,Installation of acoustic movable partitions in conference center,Installation of acoustic movable partitions in conference center,,Self,Single,Any,,Partitions,Apply Work,Permanent,,,,,,,,,,,,,,,,,,,1,1,,,,,,,,,110000,Immediate,,,,,,Common,Low,,
W116,W,Design and installation of interactive LED marquee for arts center,Design and installation of interactive LED marquee for arts center,,Self,Single,Any,,Marquees,Apply Work,Permanent,,,,,,,,,,,,,,,,,,,1,1,,,,,,,,,150000,Immediate,,,,,,Common,Low,,
W117,W,Implementation of permeable paving system for eco-friendly streetscape,Implementation of permeable paving system for eco-friendly streetscape,,Self,Single,Any,,BPP (Builder Pavement Plan),Apply Work,Permanent,,,,,,,,,,,,,,,,,,,1,1,,,,,,,,,200000,Immediate,,,,,,Common,Low,,
W118,W,Construction of net-zero energy certified office building,Construction of net-zero energy certified office building,,Self,Single,Any,,New Building,Apply Work,Permanent,,,,,,,,,,,,,,,,,,,1,1,,,,,,,,,15000000,Immediate,,,,,,Common,Low,,
W119,W,Installation of automated material handling system in distribution center,Installation of automated material handling system in distribution center,,Self,Single,Any,,Equipment Work,Apply Work,Permanent,,,,,,,,,,,,,,,,,,,1,1,,,,,,,,,800000,Immediate,,,,,,Common,Low,,
W120,W,Implementation of voice evacuation system in large shopping mall,Implementation of voice evacuation system in large shopping mall,,Self,Single,Any,,Fire Alarm,Apply Work,Permanent,,,,,,,,,,,,,,,,,,,1,1,,,,,,,,,250000,Immediate,,,,,,Common,Low,,
W121,W,Comprehensive life safety upgrade package for university dormitory complex,Comprehensive life safety upgrade package for university dormitory complex,,Self,Single,Any,,Combined,Apply Work,Permanent,,,,,,,,,,,,,,,,,,,1,1,,,,,,,,,2000000,Immediate,,,,,,Common,Low,,
W122,W,Installation of energy-efficient lighting system in retail store,Installation of energy-efficient lighting system in retail store,,Self,Single,Any,,Limited Alteration Application,Apply Work,Permanent,,,,,,,,,,,,,,,,,,,1,1,,,,,,,,,25000,Immediate,,,,,,Common,Low,,
W123,W,Setup of temporary ice skating rink with associated structures in public park,Setup of temporary ice skating rink with associated structures in public park,,Self,Single,Any,,Temporary Place of Assembly,Apply Work,Permanent,,,,,,,,,,,,,,,,,,,1,1,,,,,,,,,180000,Immediate,,,,,,Common,Low,,
W124,W,Installation of destination dispatch elevator system in office high-rise,Installation of destination dispatch elevator system in office high-rise,,Self,Single,Any,,Elevator,Apply Work,Permanent,,,,,,,,,,,,,,,,,,,1,1,,,,,,,,,1200000,Immediate,,,,,,Common,Low,,
W125,W,Conversion of abandoned factory into multi-use performance arts center,Conversion of abandoned factory into multi-use performance arts center,,Self,Single,Any,,Place of Assembly,Apply Work,Permanent,,,,,,,,,,,,,,,,,,,1,1,,,,,,,,,5000000,Immediate,,,,,,Common,Low,,
W126,W,Installation of cogeneration system for district heating and power,Installation of cogeneration system for district heating and power,,Self,Single,Any,,Fuel Burning,Apply Work,Permanent,,,,,,,,,,,,,,,,,,,1,1,,,,,,,,,3500000,Immediate,,,,,,Common,Low,,
W127,W,Renovation of subway station for improved accessibility,Renovation of subway station for improved accessibility,,Self,Single,Any,,General Construction,Apply Work,Permanent,,,,,,,,,,,,,,,,,,,1,1,,,,,,,,,8500000,Immediate,,,,,,Common,Low,,
W128,W,Construction of green roof on existing convention center,Construction of green roof on existing convention center,,Self,Single,Any,,General Construction,Apply Work,Permanent,,,,,,,,,,,,,,,,,,,1,1,,,,,,,,,1500000,Immediate,,,,,,Common,Low,,
W129,W,Conversion of parking garage into urban farming facility,Conversion of parking garage into urban farming facility,,Self,Single,Any,,General Construction,Apply Work,Permanent,,,,,,,,,,,,,,,,,,,1,1,,,,,,,,,2800000,Immediate,,,,,,Common,Low,,
W130,W,Restoration of historic lighthouse and keeper's quarters,Restoration of historic lighthouse and keeper's quarters,,Self,Single,Any,,General Construction,Apply Work,Permanent,,,,,,,,,,,,,,,,,,,1,1,,,,,,,,,950000,Immediate,,,,,,Common,Low,,
W131,W,Construction of net-zero energy public library,Construction of net-zero energy public library,,Self,Single,Any,,General Construction,Apply Work,Permanent,,,,,,,,,,,,,,,,,,,1,1,,,,,,,,,6500000,Immediate,,,,,,Common,Low,,
W132,W,Renovation of sports arena for improved spectator experience,Renovation of sports arena for improved spectator experience,,Self,Single,Any,,General Construction,Apply Work,Permanent,,,,,,,,,,,,,,,,,,,1,1,,,,,,,,,12000000,Immediate,,,,,,Common,Low,,
W133,W,Adaptive reuse of power plant into contemporary art museum,Adaptive reuse of power plant into contemporary art museum,,Self,Single,Any,,General Construction,Apply Work,Permanent,,,,,,,,,,,,,,,,,,,1,1,,,,,,,,,9000000,Immediate,,,,,,Common,Low,,
W134,W,Construction of wildlife crossing bridge over highway,Construction of wildlife crossing bridge over highway,,Self,Single,Any,,General Construction,Apply Work,Permanent,,,,,,,,,,,,,,,,,,,1,1,,,,,,,,,4500000,Immediate,,,,,,Common,Low,,
W135,W,Renovation of cruise ship terminal for increased capacity,Renovation of cruise ship terminal for increased capacity,,Self,Single,Any,,General Construction,Apply Work,Permanent,,,,,,,,,,,,,,,,,,,1,1,,,,,,,,,7000000,Immediate,,,,,,Common,Low,,
W136,W,Construction of modular affordable housing development,Construction of modular affordable housing development,,Self,Single,Any,,General Construction,Apply Work,Permanent,,,,,,,,,,,,,,,,,,,1,1,,,,,,,,,5500000,Immediate,,,,,,Common,Low,,
W137,W,Retrofit of office tower for post-pandemic workplace design,Retrofit of office tower for post-pandemic workplace design,,Self,Single,Any,,General Construction,Apply Work,Permanent,,,,,,,,,,,,,,,,,,,1,1,,,,,,,,,3200000,Immediate,,,,,,Common,Low,,
W138,W,Renovation of former post office into food hall,Renovation of former post office into food hall,,Self,Single,Any,,General Construction,Apply Work,Permanent,,,,,,,,,,,,,,,,,,,1,1,,,,,,,,,2500000,Immediate,,,,,,Common,Low,,
W139,W,Construction of disaster-resistant community center,Construction of disaster-resistant community center,,Self,Single,Any,,General Construction,Apply Work,Permanent,,,,,,,,,,,,,,,,,,,1,1,,,,,,,,,3800000,Immediate,,,,,,Common,Low,,
W140,W,Adaptive reuse of grain silo into rock climbing facility,Adaptive reuse of grain silo into rock climbing facility,,Self,Single,Any,,General Construction,Apply Work,Permanent,,,,,,,,,,,,,,,,,,,1,1,,,,,,,,,1800000,Immediate,,,,,,Common,Low,,
W141,W,Renovation of historic train station into boutique hotel,Renovation of historic train station into boutique hotel,,Self,Single,Any,,General Construction,Apply Work,Permanent,,,,,,,,,,,,,,,,,,,1,1,,,,,,,,,6800000,Immediate,,,,,,Common,Low,,
W142,W,Construction of floating pedestrian bridge in city park,Construction of floating pedestrian bridge in city park,,Self,Single,Any,,General Construction,Apply Work,Permanent,,,,,,,,,,,,,,,,,,,1,1,,,,,,,,,4200000,Immediate,,,,,,Common,Low,,
W143,W,Conversion of big box store into e-commerce fulfillment center,Conversion of big box store into e-commerce fulfillment center,,Self,Single,Any,,General Construction,Apply Work,Permanent,,,,,,,,,,,,,,,,,,,1,1,,,,,,,,,3500000,Immediate,,,,,,Common,Low,,
W144,W,Renovation of former church into community arts center,Renovation of former church into community arts center,,Self,Single,Any,,General Construction,Apply Work,Permanent,,,,,,,,,,,,,,,,,,,1,1,,,,,,,,,2200000,Immediate,,,,,,Common,Low,,
W145,W,Construction of eco-friendly car wash facility,Construction of eco-friendly car wash facility,,Self,Single,Any,,General Construction,Apply Work,Permanent,,,,,,,,,,,,,,,,,,,1,1,,,,,,,,,950000,Immediate,,,,,,Common,Low,,
W146,W,Adaptive reuse of shipping containers for retail pop-up village,Adaptive reuse of shipping containers for retail pop-up village,,Self,Single,Any,,General Construction,Apply Work,Permanent,,,,,,,,,,,,,,,,,,,1,1,,,,,,,,,1500000,Immediate,,,,,,Common,Low,,
W147,W,Renovation of zoo exhibits for improved animal welfare,Renovation of zoo exhibits for improved animal welfare,,Self,Single,Any,,General Construction,Apply Work,Permanent,,,,,,,,,,,,,,,,,,,1,1,,,,,,,,,5800000,Immediate,,,,,,Common,Low,,
W148,W,Installation of water reclamation system for car wash facility,Installation of water reclamation system for car wash facility,,Self,Single,Any,,Plumbing,Apply Work,Permanent,,,,,,,,,,,,,,,,,,,1,1,,,,,,,,,180000,Immediate,,,,,,Common,Low,,
W149,W,New plumbing systems for floating home community,New plumbing systems for floating home community,,Self,Single,Any,,Plumbing,Apply Work,Permanent,,,,,,,,,,,,,,,,,,,1,1,,,,,,,,,420000,Immediate,,,,,,Common,Low,,
W150,W,Installation of vacuum waste collection system for airport terminal,Installation of vacuum waste collection system for airport terminal,,Self,Single,Any,,Plumbing,Apply Work,Permanent,,,,,,,,,,,,,,,,,,,1,1,,,,,,,,,750000,Immediate,,,,,,Common,Low,,
W151,W,Upgrade of plumbing fixtures in sports stadium for water conservation,Upgrade of plumbing fixtures in sports stadium for water conservation,,Self,Single,Any,,Plumbing,Apply Work,Permanent,,,,,,,,,,,,,,,,,,,1,1,,,,,,,,,280000,Immediate,,,,,,Common,Low,,
W152,W,New hot water distribution system for large hospital complex,New hot water distribution system for large hospital complex,,Self,Single,Any,,Plumbing,Apply Work,Permanent,,,,,,,,,,,,,,,,,,,1,1,,,,,,,,,550000,Immediate,,,,,,Common,Low,,
W153,W,Installation of radiant floor heating system in luxury home,Installation of radiant floor heating system in luxury home,,Self,Single,Any,,Plumbing,Apply Work,Permanent,,,,,,,,,,,,,,,,,,,1,1,,,,,,,,,95000,Immediate,,,,,,Common,Low,,
W154,W,Replacement of aging water mains in downtown business district,Replacement of aging water mains in downtown business district,,Self,Single,Any,,Plumbing,Apply Work,Permanent,,,,,,,,,,,,,,,,,,,1,1,,,,,,,,,1200000,Immediate,,,,,,Common,Low,,
W155,W,Installation of displacement ventilation system in lecture hall,Installation of displacement ventilation system in lecture hall,,Self,Single,Any,,Mechanical Systems,Apply Work,Permanent,,,,,,,,,,,,,,,,,,,1,1,,,,,,,,,250000,Immediate,,,,,,Common,Low,,
