card_id,card_type,card_name,description,flavor_text,target,scope,phase_restriction,space_restriction,work_type_restriction,immediate_effect,duration,duration_count,turn_effect,money_cost,money_effect,percentage_effect,time_effect,tick_modifier,dice_trigger,dice_effect,conditional_logic,draw_cards,discard_cards,card_type_filter,movement_effect,space_effect,inspection_effect,player_state_check,game_state_check,stacking_limit,usage_limit,cooldown,combo_requirement,prerequisite,priority,queue_effect,loan_amount,loan_rate,investment_amount,work_cost,activation_timing,chain_effect,nullify_effect,environmental_factor,social_factor,political_factor,rarity,distribution_level,,
L013,L,Endangered Species Habitat,Roll a die. On 1-3 the project is in a designated habitat area; increase the permit filing time by 6 ticks. On 4-6 no effect.,Environmental concerns require extensive habitat impact studies before construction can proceed.,Self,Single,Any,,,Apply Card,Immediate,,,,,,6,,,On Play,Roll die: 1-3 increase filing time by 6,,,,,,,,,1,1,,,,,,,,,,Immediate,,,,,,Common,Low,,
L014,L,Funding Delay,Skip your next turn.,A delay in project financing forces a pause in the filing process.,Self,Single,Any,,,Apply Card,Immediate,,,,,,,,,,Skip next turn,,,,,,,,,1,1,,,,,,,,,,Immediate,,,,,,Common,Low,,
L015,L,Annexation,The current filing takes 5 ticks more time but the player's next turn takes 2 ticks less time.,The project area is annexed by the city leading to jurisdiction changes and future streamlining.,Self,Single,Any,,,Apply Card,Immediate,,,,,,5,,,Next turn: reduce time by 2 ticks,,,,,,,,,1,1,,,,,,,,,,Immediate,,,,,,Common,Low,,
L016,L,Expeditor Lobbying,The next inspection takes 2 ticks less time. Discard 1 Expeditor card.,Expeditors successfully lobby for more efficient inspection processes but some shady deals are made.,Self,Single,CONSTRUCTION,,,Apply Card,Immediate,,,,,,-2,,,,,,1,,E,,,,,1,1,,,,,,,,,,Immediate,,,,,,Common,Low,,
L017,L,Neighborhood Revitalization,Roll a die. On 1-3 the project is in a targeted revitalization area; reduce the permit filing time by 3 ticks. On 4-6 no effect.,City initiatives to revitalize neighborhoods provide incentives for new development projects.,Self,Single,Any,,,Apply Card,Immediate,,,,,,-3,,,On Play,Roll die: 1-3 reduce filing time by 3,,,,,,,,,1,1,,,,,,,,,,Immediate,,,,,,Common,Low,,
L018,L,Bribery Scandal,All permit filing times increase by 2 ticks for the next 3 turns.,A bribery scandal involving city officials leads to increased scrutiny and slower approvals.,All Players,Global,Any,,,Apply Card,Turns,3,,,,,2,,,,,,,,,,,,,1,1,,,,,,,,,,Immediate,,,,,,Common,Low,,
L019,L,Planning Department Backlog,The current filing takes 3 ticks more time.,An influx of filings creates a backlog at the planning department.,Self,Single,Any,,,Apply Card,Immediate,,,,,,3,,,,,,,,,,,,,1,1,,,,,,,,,,Immediate,,,,,,Common,Low,,
L020,L,Building Code Update,All inspection times increase by 2 ticks for the next 2 turns.,A building code update requires expeditors to adjust their inspection preparations.,All Players,Global,CONSTRUCTION,,,Apply Card,Turns,2,,,,,2,,,,,,,,,,,,,1,1,,,,,,,,,,Immediate,,,,,,Common,Low,,
L021,L,High-Profile Client,The current filing time is reduced by 4 ticks. All other players' current filing time increases by 1 tick.,Expectations are high for a notable client's project so it gets prioritized much to other expeditors' chagrin.,Self,Single,Any,,,Apply Card,Immediate,,,,,,-4,,,All other players: +1 tick,,,,,,,,,1,1,,,,,,,,,,Immediate,,,,,,Common,Low,,
L022,L,Economic Boom,All construction times decrease by 2 ticks for the next 3 turns.,A thriving economy boosts construction productivity.,All Players,Global,CONSTRUCTION,,,Apply Card,Turns,3,,,,,,-2,,,,,,,,,,,,,1,1,,,,,,,,,,Immediate,,,,,,Common,Low,,
L023,L,Project Redesign,The current filing is delayed indefinitely. Discard 2 Expeditor cards.,The client requests a major redesign sending the expeditor back to square one.,Self,Single,Any,,,Apply Card,Immediate,,,,,,,,,Delay filing indefinitely,,,2,,E,,,,,1,1,,,,,,,,,,Immediate,,,,,,Common,Low,,
L024,L,Expeditor Conference,Skip this turn. Draw 2 Expeditor Cards.,The expeditor attends an industry conference to network and learn but no filings get done.,Self,Single,Any,,,Apply Card,Immediate,,,,,,,,,Skip this turn,,,2,,E,,,,,1,1,,,,,,,,,,Immediate,,,,,,Common,Low,,
L025,L,Celebrity Endorsement,Roll a die. On 1-3 the project is high-profile; reduce the permit filing time by 4 ticks. On 4-6 no effect.,A celebrity endorsement brings positive attention and political pressure to approve the project quickly.,Self,Single,Any,,,Apply Card,Immediate,,,,,,-4,,,On Play,Roll die: 1-3 reduce filing time by 4,,,,,,,,,1,1,,,,,,,,,,Immediate,,,,,,Common,Low,,
L026,L,Community Outreach,All permit filing times decrease by 1 tick this turn.,Proactive community outreach by expeditors improves neighborhood relations.,Self,Single,Any,,,Apply Card,Immediate,,,,,,,,,,,,,,,,,,,1,1,,,,,,,,,,Immediate,,,,,,Common,Low,,
L027,L,Permit Office Upgrade,All players' current filing times decrease by 2 ticks.,Improved technology at the permit office increases efficiency.,All Players,Global,Any,,,Apply Card,Immediate,,,,,,,,,,,,,,,,,,,1,1,,,,,,,,,,Immediate,,,,,,Common,Low,,
L028,L,Surprise Inspection,The next inspection takes 4 ticks more time.,An unannounced inspection catches the project team off-guard.,Self,Single,CONSTRUCTION,,,Apply Card,Immediate,,,,,,4,,,,,,,,,,,,,1,1,,,,,,,,,,Immediate,,,,,,Common,Low,,
L029,L,Utility Delay,If the project requires utility hookups increase the filing time by 3 ticks.,Bureaucratic issues with utility companies delay necessary hookups.,Self,Single,Any,,,Apply Card,Immediate,,,,,,,,,,,,,,,,,,,1,1,,,,,,,,,,Immediate,,,,,,Common,Low,,
L030,L,Cybersecurity Breach,All filing times increase by 1 tick for the next 2 turns.,A data breach at the permit office disrupts normal operations.,Self,Single,Any,,,Apply Card,Turns,2,,,,,,,,,,,,,,,,,,1,1,,,,,,,,,,Immediate,,,,,,Common,Low,,
L031,L,Permit Fee Hike,The current permit filing costs 2 extra resources but takes 2 ticks less time.,Increased permit fees allow the office to hire more staff and decrease processing times.,Self,Single,Any,,,Apply Card,Immediate,,,,,,,,,,,,,,,,,,,1,1,,,,,,,,,,Immediate,,,,,,Common,Low,,
L032,L,Diversity Initiative,Roll a die. On 1-3 the project team is diverse; reduce the inspection time by 2 ticks. On 4-6 no effect.,Diversity in project teams is recognized and rewarded with streamlined approval processes.,Self,Single,CONSTRUCTION,,,Apply Card,Immediate,,,,,,-2,,,On Play,Roll die: 1-3 reduce inspection time by 2,,,,,,,,,1,1,,,,,,,,,,Immediate,,,,,,Common,Low,,
L033,L,Worksite Injury,All construction times increase by 3 ticks this turn.,An injury at a project worksite leads to safety investigations and work stoppages.,Self,Single,Any,,,Apply Card,Immediate,,,,,,,,,,,,,,,,,,,1,1,,,,,,,,,,Immediate,,,,,,Common,Low,,
L034,L,Natural Disaster,All filing and inspection times increase by 4 ticks for the next 2 turns.,A severe storm causes damage and delays throughout the city.,Self,Single,Any,,,Apply Card,Turns,2,,,,,,,,,,,,,,,,,,1,1,,,,,,,,,,Immediate,,,,,,Common,Low,,
L035,L,Expeditor Quits,Skip your next turn. Discard 2 Expeditor cards.,A key expeditor quits without notice leaving their projects in limbo.,Self,Single,Any,,,Apply Card,Immediate,,,,,,,,,,,,,,,,,,,1,1,,,,,,,,,,Immediate,,,,,,Common,Low,,
L036,L,City Budget Surplus,All permit filing times decrease by 2 ticks this turn.,A city budget surplus allows permit offices to extend their hours.,Self,Single,Any,,,Apply Card,Immediate,,,,,,,,,,,,,,,,,,,1,1,,,,,,,,,,Immediate,,,,,,Common,Low,,
L037,L,Affordable Housing Initiative,Roll a die. On 1-3 the project includes affordable housing; reduce the permit filing time by 5 ticks. On 4-6 no effect.,Affordable housing projects receive priority processing to address the city's housing crisis.,Self,Single,Any,,,Apply Card,Immediate,,,,,,,,,,,,,,,,,,,1,1,,,,,,,,,,Immediate,,,,,,Common,Low,,
L038,L,Intern Error,The current filing time increases by 2 ticks.,A mistake by a new expeditor intern causes a minor delay.,Self,Single,Any,,,Apply Card,Immediate,,,,,,,,,,,,,,,,,,,1,1,,,,,,,,,,Immediate,,,,,,Common,Low,,
L039,L,Rezoning Request,The current filing time increases by 3 ticks. Draw 1 Expeditor Card.,A rezoning request complicates the project but may open up future opportunities.,Self,Single,Any,,,Apply Card,Immediate,,,,,,,,,,,,,,,,,,,1,1,,,,,,,,,,Immediate,,,,,,Common,Low,,
L040,L,Historical Preservation,Roll a die. On 1-3 the project involves a historic building; increase the filing time by 4 ticks. On 4-6 no effect.,Historic buildings require extensive review to ensure preservation standards are met.,Self,Single,Any,,,Apply Card,Immediate,,,,,,,,,,,,,,,,,,,1,1,,,,,,,,,,Immediate,,,,,,Common,Low,,
L041,L,Competing Projects,Ask each other player about their current worktypes. If any player has the same worktype as you increase your filing time by 2 ticks.,Competition for limited city resources slows down similar projects.,Self,Single,Any,,,Apply Card,Immediate,,,,,,,,,,,,,,,,,,,1,1,,,,,,,,,,Immediate,,,,,,Common,Low,,
L042,L,Sister City Collaboration,All players' current filing times decrease by 1 tick.,A delegation from a sister city shares their best practices for efficient permitting.,All Players,Global,Any,,,Apply Card,Immediate,,,,,,,,,,,,,,,,,,,1,1,,,,,,,,,,Immediate,,,,,,Common,Low,,
L043,L,Green Building Bonus,Roll a die. On 1-3 the project is LEED certified; reduce the total filing time by 3 ticks. On 4-6 no effect.,Environmentally sustainable projects receive expedited approval as part of the city's green initiative.,Self,Single,Any,,,Apply Card,Immediate,,,,,,,,,,,,,,,,,,,1,1,,,,,,,,,,Immediate,,,,,,Common,Low,,
L044,L,State Funding,The current high-profile project filing time is reduced by 4 ticks.,The state provides extra funding to speed up a significant local project.,Self,Single,Any,,,Apply Card,Immediate,,,,,,,,,,,,,,,,,,,1,1,,,,,,,,,,Immediate,,,,,,Common,Low,,
L045,L,Mayor's Pet Project,Roll a die. On 1-3 the mayor expresses interest in the project; reduce its filing time by 5 ticks. On 4-6 no effect.,When the mayor takes a personal interest in a project bureaucratic obstacles tend to disappear.,Self,Single,Any,,,Apply Card,Immediate,,,,,,,,,,,,,,,,,,,1,1,,,,,,,,,,Immediate,,,,,,Common,Low,,
L046,L,Expeditor Awards,The player with the most completed projects reduces their current filing time by 4 ticks.,An expeditor's association recognizes the city's top performer lending them extra credibility.,Self,Single,Any,,,Apply Card,Immediate,,,,,,,,,,,,,,,,,,,1,1,,,,,,,,,,Immediate,,,,,,Common,Low,,
L047,L,Political Gridlock,All filing times increase by 1 tick for the next 5 turns.,A contentious election leads to political paralysis and government inefficiencies.,Self,Single,Any,,,Apply Card,Turns,5,,,,,,,,,,,,,,,,,,1,1,,,,,,,,,,Immediate,,,,,,Common,Low,,
L048,L,Graft Investigation,All permit filings are halted for 1 turn while players discard half their Expeditor cards.,Authorities investigate widespread corruption bringing permitting to a standstill.,Self,Single,Any,,,Apply Card,Turns,1,,,,,,,,,,,,,,,,,,1,1,,,,,,,,,,Immediate,,,,,,Common,Low,,
L049,L,Permitting Process Overhaul,All filing times are reduced by 2 ticks for the remainder of the game. Each player draws 1 Expeditor Card.,The city unveils a long-awaited streamlining of the permitting process.,Self,Single,Any,,,Apply Card,Immediate,,,,,,,,,,,,,,,,,,,1,1,,,,,,,,,,Immediate,,,,,,Common,Low,,
W001,W,Lobby renovation and security upgrade for corporate headquarters,Lobby renovation and security upgrade for corporate headquarters,First impressions matter - make yours count.,Self,Single,Any,,General Construction,Apply Work,Permanent,,,,,,,,,,,,,,,,,,,1,1,,,,,,,,,150000,Immediate,,,,,,Common,Low,,
W002,W,Conversion of attic space into habitable loft in single-family home,Conversion of attic space into habitable loft in single-family home,Hidden spaces hold the greatest potential for transformation.,Self,Single,Any,,General Construction,Apply Work,Permanent,,,,,,,,,,,,,,,,,,,1,1,,,,,,,,,80000,Immediate,,,,,,Common,Low,,
W003,W,Installation of green wall and rooftop garden for eco-friendly office building,Installation of green wall and rooftop garden for eco-friendly office building,Bringing nature back to the urban jungle.,Self,Single,Any,,General Construction,Apply Work,Permanent,,,,,,,,,,,,,,,,,,,1,1,,,,,,,,,200000,Immediate,,,,,,Common,Low,,
W004,W,Renovation of historic theater including restoration of ornate plasterwork,Renovation of historic theater including restoration of ornate plasterwork,,Self,Single,Any,,General Construction,Apply Work,Permanent,,,,,,,,,,,,,,,,,,,1,1,,,,,,,,,950000,Immediate,,,,,,Common,Low,,
W005,W,Construction of new emergency department addition to existing hospital,Construction of new emergency department addition to existing hospital,,Self,Single,Any,,General Construction,Apply Work,Permanent,,,,,,,,,,,,,,,,,,,1,1,,,,,,,,,4500000,Immediate,,,,,,Common,Low,,
W006,W,Adaptive reuse of abandoned warehouse into mixed-use development,Adaptive reuse of abandoned warehouse into mixed-use development,,Self,Single,Any,,General Construction,Apply Work,Permanent,,,,,,,,,,,,,,,,,,,1,1,,,,,,,,,3000000,Immediate,,,,,,Common,Low,,
W007,W,Energy-efficient retrofit of 1960s office building,Energy-efficient retrofit of 1960s office building,,Self,Single,Any,,General Construction,Apply Work,Permanent,,,,,,,,,,,,,,,,,,,1,1,,,,,,,,,1200000,Immediate,,,,,,Common,Low,,
W008,W,Expansion of public library with new children's wing,Expansion of public library with new children's wing,,Self,Single,Any,,General Construction,Apply Work,Permanent,,,,,,,,,,,,,,,,,,,1,1,,,,,,,,,2500000,Immediate,,,,,,Common,Low,,
W009,W,Conversion of strip mall into senior living community,Conversion of strip mall into senior living community,,Self,Single,Any,,General Construction,Apply Work,Permanent,,,,,,,,,,,,,,,,,,,1,1,,,,,,,,,5000000,Immediate,,,,,,Common,Low,,
W010,W,Restoration of fire-damaged apartment building,Restoration of fire-damaged apartment building,,Self,Single,Any,,General Construction,Apply Work,Permanent,,,,,,,,,,,,,,,,,,,1,1,,,,,,,,,800000,Immediate,,,,,,Common,Low,,
W011,W,Construction of rooftop amenity space for luxury condominium,Construction of rooftop amenity space for luxury condominium,,Self,Single,Any,,General Construction,Apply Work,Permanent,,,,,,,,,,,,,,,,,,,1,1,,,,,,,,,600000,Immediate,,,,,,Common,Low,,
W012,W,Renovation of industrial space into trendy restaurant,Renovation of industrial space into trendy restaurant,,Self,Single,Any,,General Construction,Apply Work,Permanent,,,,,,,,,,,,,,,,,,,1,1,,,,,,,,,450000,Immediate,,,,,,Common,Low,,
W013,W,Accessibility upgrades for historic courthouse,Accessibility upgrades for historic courthouse,,Self,Single,Any,,General Construction,Apply Work,Permanent,,,,,,,,,,,,,,,,,,,1,1,,,,,,,,,350000,Immediate,,,,,,Common,Low,,
W014,W,Conversion of former school into affordable housing units,Conversion of former school into affordable housing units,,Self,Single,Any,,General Construction,Apply Work,Permanent,,,,,,,,,,,,,,,,,,,1,1,,,,,,,,,4000000,Immediate,,,,,,Common,Low,,
W015,W,Facade restoration of Art Deco skyscraper,Facade restoration of Art Deco skyscraper,,Self,Single,Any,,General Construction,Apply Work,Permanent,,,,,,,,,,,,,,,,,,,1,1,,,,,,,,,1800000,Immediate,,,,,,Common,Low,,
W016,W,Construction of new visitor center for national park,Construction of new visitor center for national park,,Self,Single,Any,,General Construction,Apply Work,Permanent,,,,,,,,,,,,,,,,,,,1,1,,,,,,,,,2000000,Immediate,,,,,,Common,Low,,
W017,W,Renovation of airport terminal for improved passenger flow,Renovation of airport terminal for improved passenger flow,,Self,Single,Any,,General Construction,Apply Work,Permanent,,,,,,,,,,,,,,,,,,,1,1,,,,,,,,,7500000,Immediate,,,,,,Common,Low,,
W018,W,Conversion of big box store into indoor vertical farm,Conversion of big box store into indoor vertical farm,,Self,Single,Any,,General Construction,Apply Work,Permanent,,,,,,,,,,,,,,,,,,,1,1,,,,,,,,,3500000,Immediate,,,,,,Common,Low,,
W019,W,Seismic retrofit and renovation of city hall,Seismic retrofit and renovation of city hall,,Self,Single,Any,,General Construction,Apply Work,Permanent,,,,,,,,,,,,,,,,,,,1,1,,,,,,,,,6000000,Immediate,,,,,,Common,Low,,
W020,W,Construction of new performing arts center on university campus,Construction of new performing arts center on university campus,,Self,Single,Any,,General Construction,Apply Work,Permanent,,,,,,,,,,,,,,,,,,,1,1,,,,,,,,,12000000,Immediate,,,,,,Common,Low,,
W021,W,Renovation of historic hotel into boutique accommodation,Renovation of historic hotel into boutique accommodation,,Self,Single,Any,,General Construction,Apply Work,Permanent,,,,,,,,,,,,,,,,,,,1,1,,,,,,,,,5500000,Immediate,,,,,,Common,Low,,
W022,W,Construction of new fire station with training facilities,Construction of new fire station with training facilities,,Self,Single,Any,,General Construction,Apply Work,Permanent,,,,,,,,,,,,,,,,,,,1,1,,,,,,,,,3800000,Immediate,,,,,,Common,Low,,
W023,W,Installation of gray water recycling system for large apartment complex,Installation of gray water recycling system for large apartment complex,,Self,Single,Any,,Plumbing,Apply Work,Permanent,,,,,,,,,,,,,,,,,,,1,1,,,,,,,,,350000,Immediate,,,,,,Common,Low,,
W024,W,Replacement of lead service lines for entire city block of rowhouses,Replacement of lead service lines for entire city block of rowhouses,,Self,Single,Any,,Plumbing,Apply Work,Permanent,,,,,,,,,,,,,,,,,,,1,1,,,,,,,,,500000,Immediate,,,,,,Common,Low,,
W025,W,New cryogenic piping system for research laboratory,New cryogenic piping system for research laboratory,,Self,Single,Any,,Plumbing,Apply Work,Permanent,,,,,,,,,,,,,,,,,,,1,1,,,,,,,,,180000,Immediate,,,,,,Common,Low,,
W026,W,Installation of solar thermal hot water system for hotel,Installation of solar thermal hot water system for hotel,,Self,Single,Any,,Plumbing,Apply Work,Permanent,,,,,,,,,,,,,,,,,,,1,1,,,,,,,,,120000,Immediate,,,,,,Common,Low,,
W027,W,Upgrade of plumbing fixtures to low-flow models in university dormitory,Upgrade of plumbing fixtures to low-flow models in university dormitory,,Self,Single,Any,,Plumbing,Apply Work,Permanent,,,,,,,,,,,,,,,,,,,1,1,,,,,,,,,90000,Immediate,,,,,,Common,Low,,
W028,W,Installation of rainwater harvesting system for office park,Installation of rainwater harvesting system for office park,,Self,Single,Any,,Plumbing,Apply Work,Permanent,,,,,,,,,,,,,,,,,,,1,1,,,,,,,,,280000,Immediate,,,,,,Common,Low,,
W029,W,Replacement of corroded plumbing stack in high-rise condominium,Replacement of corroded plumbing stack in high-rise condominium,,Self,Single,Any,,Plumbing,Apply Work,Permanent,,,,,,,,,,,,,,,,,,,1,1,,,,,,,,,200000,Immediate,,,,,,Common,Low,,
W030,W,New medical gas system for hospital expansion,New medical gas system for hospital expansion,,Self,Single,Any,,Plumbing,Apply Work,Permanent,,,,,,,,,,,,,,,,,,,1,1,,,,,,,,,450000,Immediate,,,,,,Common,Low,,
W031,W,Installation of greywater system for public park irrigation,Installation of greywater system for public park irrigation,,Self,Single,Any,,Plumbing,Apply Work,Permanent,,,,,,,,,,,,,,,,,,,1,1,,,,,,,,,150000,Immediate,,,,,,Common,Low,,
W032,W,Upgrade of storm drainage system for large industrial site,Upgrade of storm drainage system for large industrial site,,Self,Single,Any,,Plumbing,Apply Work,Permanent,,,,,,,,,,,,,,,,,,,1,1,,,,,,,,,320000,Immediate,,,,,,Common,Low,,
W033,W,New plumbing system for food processing facility,New plumbing system for food processing facility,,Self,Single,Any,,Plumbing,Apply Work,Permanent,,,,,,,,,,,,,,,,,,,1,1,,,,,,,,,380000,Immediate,,,,,,Common,Low,,
W034,W,Installation of water treatment system for brewery,Installation of water treatment system for brewery,,Self,Single,Any,,Plumbing,Apply Work,Permanent,,,,,,,,,,,,,,,,,,,1,1,,,,,,,,,110000,Immediate,,,,,,Common,Low,,
W035,W,Replacement of aging sewer lines in historic district,Replacement of aging sewer lines in historic district,,Self,Single,Any,,Plumbing,Apply Work,Permanent,,,,,,,,,,,,,,,,,,,1,1,,,,,,,,,600000,Immediate,,,,,,Common,Low,,
W036,W,New plumbing for green building with composting toilets,New plumbing for green building with composting toilets,,Self,Single,Any,,Plumbing,Apply Work,Permanent,,,,,,,,,,,,,,,,,,,1,1,,,,,,,,,85000,Immediate,,,,,,Common,Low,,
W037,W,Installation of snowmelt system for pedestrian plaza,Installation of snowmelt system for pedestrian plaza,,Self,Single,Any,,Plumbing,Apply Work,Permanent,,,,,,,,,,,,,,,,,,,1,1,,,,,,,,,95000,Immediate,,,,,,Common,Low,,
W038,W,Upgrade of plumbing systems in century-old apartment building,Upgrade of plumbing systems in century-old apartment building,,Self,Single,Any,,Plumbing,Apply Work,Permanent,,,,,,,,,,,,,,,,,,,1,1,,,,,,,,,250000,Immediate,,,,,,Common,Low,,
W039,W,Installation of geothermal heating and cooling system for new school campus,Installation of geothermal heating and cooling system for new school campus,,Self,Single,Any,,Mechanical Systems,Apply Work,Permanent,,,,,,,,,,,,,,,,,,,1,1,,,,,,,,,2500000,Immediate,,,,,,Common,Low,,
W040,W,Retrofit of existing HVAC system with UV air purification for medical facility,Retrofit of existing HVAC system with UV air purification for medical facility,,Self,Single,Any,,Mechanical Systems,Apply Work,Permanent,,,,,,,,,,,,,,,,,,,1,1,,,,,,,,,400000,Immediate,,,,,,Common,Low,,
W041,W,New clean room HVAC system for semiconductor manufacturing plant,New clean room HVAC system for semiconductor manufacturing plant,,Self,Single,Any,,Mechanical Systems,Apply Work,Permanent,,,,,,,,,,,,,,,,,,,1,1,,,,,,,,,1800000,Immediate,,,,,,Common,Low,,
W042,W,Installation of heat recovery ventilation system in passive house project,Installation of heat recovery ventilation system in passive house project,,Self,Single,Any,,Mechanical Systems,Apply Work,Permanent,,,,,,,,,,,,,,,,,,,1,1,,,,,,,,,75000,Immediate,,,,,,Common,Low,,
W043,W,Upgrade to variable refrigerant flow (VRF) system in boutique office building,Upgrade to variable refrigerant flow (VRF) system in boutique office building,,Self,Single,Any,,Mechanical Systems,Apply Work,Permanent,,,,,,,,,,,,,,,,,,,1,1,,,,,,,,,350000,Immediate,,,,,,Common,Low,,
W044,W,Installation of district heating system for university campus,Installation of district heating system for university campus,,Self,Single,Any,,Mechanical Systems,Apply Work,Permanent,,,,,,,,,,,,,,,,,,,1,1,,,,,,,,,3000000,Immediate,,,,,,Common,Low,,
W045,W,New HVAC system for data center with hot aisle containment,New HVAC system for data center with hot aisle containment,,Self,Single,Any,,Mechanical Systems,Apply Work,Permanent,,,,,,,,,,,,,,,,,,,1,1,,,,,,,,,1200000,Immediate,,,,,,Common,Low,,
W046,W,Upgrade of mechanical systems in historic theater for improved acoustics,Upgrade of mechanical systems in historic theater for improved acoustics,,Self,Single,Any,,Mechanical Systems,Apply Work,Permanent,,,,,,,,,,,,,,,,,,,1,1,,,,,,,,,500000,Immediate,,,,,,Common,Low,,
W047,W,Installation of energy-efficient HVAC system in green office tower,Installation of energy-efficient HVAC system in green office tower,,Self,Single,Any,,Mechanical Systems,Apply Work,Permanent,,,,,,,,,,,,,,,,,,,1,1,,,,,,,,,2000000,Immediate,,,,,,Common,Low,,
W048,W,New mechanical systems for pharmaceutical clean room facility,New mechanical systems for pharmaceutical clean room facility,,Self,Single,Any,,Mechanical Systems,Apply Work,Permanent,,,,,,,,,,,,,,,,,,,1,1,,,,,,,,,1500000,Immediate,,,,,,Common,Low,,
W049,W,Retrofit of chiller plant for improved energy efficiency in hospital,Retrofit of chiller plant for improved energy efficiency in hospital,,Self,Single,Any,,Mechanical Systems,Apply Work,Permanent,,,,,,,,,,,,,,,,,,,1,1,,,,,,,,,800000,Immediate,,,,,,Common,Low,,
W050,W,Installation of water mist fire suppression system in data center,Installation of water mist fire suppression system in data center,,Self,Single,Any,,Sprinklers,Apply Work,Permanent,,,,,,,,,,,,,,,,,,,1,1,,,,,,,,,250000,Immediate,,,,,,Common,Low,,
W051,W,Upgrade of sprinkler system to accommodate new mezzanine in warehouse,Upgrade of sprinkler system to accommodate new mezzanine in warehouse,,Self,Single,Any,,Sprinklers,Apply Work,Permanent,,,,,,,,,,,,,,,,,,,1,1,,,,,,,,,80000,Immediate,,,,,,Common,Low,,
W052,W,Installation of foam sprinkler system in aircraft hangar,Installation of foam sprinkler system in aircraft hangar,,Self,Single,Any,,Sprinklers,Apply Work,Permanent,,,,,,,,,,,,,,,,,,,1,1,,,,,,,,,400000,Immediate,,,,,,Common,Low,,
W053,W,Retrofit of residential high-rise with new NFPA 13R sprinkler system,Retrofit of residential high-rise with new NFPA 13R sprinkler system,,Self,Single,Any,,Sprinklers,Apply Work,Permanent,,,,,,,,,,,,,,,,,,,1,1,,,,,,,,,1200000,Immediate,,,,,,Common,Low,,
W054,W,Installation of specialized sprinkler system for art storage facility,Installation of specialized sprinkler system for art storage facility,,Self,Single,Any,,Sprinklers,Apply Work,Permanent,,,,,,,,,,,,,,,,,,,1,1,,,,,,,,,150000,Immediate,,,,,,Common,Low,,
W055,W,New sprinkler system for renovated historic theater,New sprinkler system for renovated historic theater,,Self,Single,Any,,Sprinklers,Apply Work,Permanent,,,,,,,,,,,,,,,,,,,1,1,,,,,,,,,300000,Immediate,,,,,,Common,Low,,
W056,W,Upgrade of sprinkler system in college dormitory to meet current codes,Upgrade of sprinkler system in college dormitory to meet current codes,,Self,Single,Any,,Sprinklers,Apply Work,Permanent,,,,,,,,,,,,,,,,,,,1,1,,,,,,,,,180000,Immediate,,,,,,Common,Low,,
