card_id,card_type,card_name,description,flavor_text,target,scope,phase_restriction,space_restriction,work_type_restriction,immediate_effect,duration,duration_count,turn_effect,money_cost,money_effect,percentage_effect,time_effect,tick_modifier,dice_trigger,dice_effect,conditional_logic,draw_cards,discard_cards,card_type_filter,movement_effect,space_effect,inspection_effect,player_state_check,game_state_check,stacking_limit,usage_limit,cooldown,combo_requirement,prerequisite,priority,queue_effect,loan_amount,loan_rate,investment_amount,work_cost,activation_timing,chain_effect,nullify_effect,environmental_factor,social_factor,political_factor,rarity,distribution_level,,
W156,W,New HVAC system with thermal energy storage for office complex,New HVAC system with thermal energy storage for office complex,,Self,Single,Any,,Mechanical Systems,Apply Work,Permanent,,,,,,,,,,,,,,,,,,,1,1,,,,,,,,,1800000,Immediate,,,,,,Common,Low,,
W157,W,Installation of radiant cooling system in airport terminal,Installation of radiant cooling system in airport terminal,,Self,Single,Any,,Mechanical Systems,Apply Work,Permanent,,,,,,,,,,,,,,,,,,,1,1,,,,,,,,,2200000,Immediate,,,,,,Common,Low,,
W158,W,Upgrade of mechanical systems in high-security government facility,Upgrade of mechanical systems in high-security government facility,,Self,Single,Any,,Mechanical Systems,Apply Work,Permanent,,,,,,,,,,,,,,,,,,,1,1,,,,,,,,,1500000,Immediate,,,,,,Common,Low,,
W159,W,New HVAC system for indoor vertical farming facility,New HVAC system for indoor vertical farming facility,,Self,Single,Any,,Mechanical Systems,Apply Work,Permanent,,,,,,,,,,,,,,,,,,,1,1,,,,,,,,,900000,Immediate,,,,,,Common,Low,,
W160,W,Installation of deluge sprinkler system in aircraft maintenance hangar,Installation of deluge sprinkler system in aircraft maintenance hangar,,Self,Single,Any,,Sprinklers,Apply Work,Permanent,,,,,,,,,,,,,,,,,,,1,1,,,,,,,,,550000,Immediate,,,,,,Common,Low,,
W161,W,New sprinkler system for high-ceiling atrium in shopping mall,New sprinkler system for high-ceiling atrium in shopping mall,,Self,Single,Any,,Sprinklers,Apply Work,Permanent,,,,,,,,,,,,,,,,,,,1,1,,,,,,,,,320000,Immediate,,,,,,Common,Low,,
W162,W,Upgrade of sprinkler system in historic library with rare book collection,Upgrade of sprinkler system in historic library with rare book collection,,Self,Single,Any,,Sprinklers,Apply Work,Permanent,,,,,,,,,,,,,,,,,,,1,1,,,,,,,,,280000,Immediate,,,,,,Common,Low,,
W163,W,Installation of dry pipe sprinkler system in cold storage warehouse,Installation of dry pipe sprinkler system in cold storage warehouse,,Self,Single,Any,,Sprinklers,Apply Work,Permanent,,,,,,,,,,,,,,,,,,,1,1,,,,,,,,,420000,Immediate,,,,,,Common,Low,,
W164,W,New sprinkler system for multi-story car park,New sprinkler system for multi-story car park,,Self,Single,Any,,Sprinklers,Apply Work,Permanent,,,,,,,,,,,,,,,,,,,1,1,,,,,,,,,380000,Immediate,,,,,,Common,Low,,
W165,W,Structural reinforcement of dam for increased water capacity,Structural reinforcement of dam for increased water capacity,,Self,Single,Any,,Structural,Apply Work,Permanent,,,,,,,,,,,,,,,,,,,1,1,,,,,,,,,2800000,Immediate,,,,,,Common,Low,,
W166,W,Installation of base isolation system for earthquake protection in hospital,Installation of base isolation system for earthquake protection in hospital,,Self,Single,Any,,Structural,Apply Work,Permanent,,,,,,,,,,,,,,,,,,,1,1,,,,,,,,,3500000,Immediate,,,,,,Common,Low,,
W167,W,Structural modifications to support green roof on existing building,Structural modifications to support green roof on existing building,,Self,Single,Any,,Structural,Apply Work,Permanent,,,,,,,,,,,,,,,,,,,1,1,,,,,,,,,750000,Immediate,,,,,,Common,Low,,
W168,W,Installation of digital display construction fence for public information,Installation of digital display construction fence for public information,,Self,Single,Any,,Construction Fence,Apply Work,Permanent,,,,,,,,,,,,,,,,,,,1,1,,,,,,,,,110000,Immediate,,,,,,Common,Low,,
W169,W,Blast-resistant temporary fencing for demolition project,Blast-resistant temporary fencing for demolition project,,Self,Single,Any,,Construction Fence,Apply Work,Permanent,,,,,,,,,,,,,,,,,,,1,1,,,,,,,,,95000,Immediate,,,,,,Common,Low,,
W170,W,Sidewalk shed with integrated public seating and planters,Sidewalk shed with integrated public seating and planters,,Self,Single,Any,,Sidewalk Shed,Apply Work,Permanent,,,,,,,,,,,,,,,,,,,1,1,,,,,,,,,130000,Immediate,,,,,,Common,Low,,
W171,W,Temporary work platforms for clock tower restoration,Temporary work platforms for clock tower restoration,,Self,Single,Any,,Supported Scaffold,Apply Work,Permanent,,,,,,,,,,,,,,,,,,,1,1,,,,,,,,,140000,Immediate,,,,,,Common,Low,,
W172,W,Installation of emergency communication antenna system for first responders,Installation of emergency communication antenna system for first responders,,Self,Single,Any,,Antenna,Apply Work,Permanent,,,,,,,,,,,,,,,,,,,1,1,,,,,,,,,280000,Immediate,,,,,,Common,Low,,
W173,W,Installation of dual-fuel boiler system for increased resilience,Installation of dual-fuel boiler system for increased resilience,,Self,Single,Any,,Boiler Equipment,Apply Work,Permanent,,,,,,,,,,,,,,,,,,,1,1,,,,,,,,,520000,Immediate,,,,,,Common,Low,,
W174,W,Creation of kinetic facade signage for entertainment district,Creation of kinetic facade signage for entertainment district,,Self,Single,Any,,Sign,Apply Work,Permanent,,,,,,,,,,,,,,,,,,,1,1,,,,,,,,,420000,Immediate,,,,,,Common,Low,,
W175,W,Installation of solar canopy over parking lot with EV charging stations,Installation of solar canopy over parking lot with EV charging stations,,Self,Single,Any,,Solar,Apply Work,Permanent,,,,,,,,,,,,,,,,,,,1,1,,,,,,,,,680000,Immediate,,,,,,Common,Low,,
W176,W,Upgrade of standpipe system in high-rise to support higher pressure requirements,Upgrade of standpipe system in high-rise to support higher pressure requirements,,Self,Single,Any,,Standpipe,Apply Work,Permanent,,,,,,,,,,,,,,,,,,,1,1,,,,,,,,,350000,Immediate,,,,,,Common,Low,,
TEST001,B,Finance Combo Master,Master loan that gets better with investor backing,,Self,Single,Any,,,Apply Loan,Permanent,,,,25000,,,,,,,,,,,,,,,1,1,,B+I,,,,,500000,5,,,Immediate,,,,,,Rare,High,
TEST002,I,Strategic Investment Fund,Investment that chains into more opportunities,,Self,Single,Any,,,Apply Investment,Permanent,,,,50000,,,,,,,,,,,,,,,1,1,,,,,,,1000000,,,,Immediate,draw:B->if:money>200000->draw:W,,,,,Rare,High,
TEST003,W,Master Project Coordination,Work project that benefits from team diversity,,Self,Single,Any,,Complex,Apply Work,Permanent,,,,,,15,,,,,,,,,,,,,1,1,,2xW+B+I,,,,,,,,,450000,Immediate,,,,,,Rare,High
TEST004,E,Efficiency Accelerator,Expeditor that amplifies all other cards this turn,,All Players-Self,Multiple,Any,,,Apply Efficiency,Turns,2,,,,,25,,,,,,,,,,,,,1,1,,,,,,,,,,,Immediate,trigger:double_next,,,,,Epic,Very High,
TEST005,L,Work-Life Synergist,Life card that creates powerful combinations,,Choose Player,Single,Any,,,Apply Life Balance,Permanent,,,,,,,3,,,,,,,,,,,,,1,1,,W+L,,,,,,,,,Immediate,,,,,,Rare,High
TEST006,B,Cascade Funding,Bank card that triggers investment opportunities,,Self,Single,Any,,,Apply Loan,Permanent,,,,75000,,,,,,,,,,,,,,,1,1,,,,,,,800000,4,,,Immediate,draw:I->if:money>500000->trigger:bonus_turn,,,,,Epic,Very High,
E008,E,Overtime,Pay a junior expeditor ($1000) to reduce the current filing time by 2 ticks.,Working late the expeditor manages to shave off some time.,Self,Single,Any,,,Apply Card,Immediate,,,,-1000,,-2,,,,,,,,,,,,1,1,,,,,,,,,,Immediate,,,All Colors,,,Common,Low,,
E020,E,Expeditor Training,Reduce the current filing time by 1 tick for each Expeditor Card played this turn.,Investing in expeditor training pays off with increased efficiency.,Self,Single,Any,,,Apply Card,Immediate,,,,,,-1,,,,,,,,,,,,1,1,,,,,,,,,,Immediate,,,All Colors,,,Common,Low,,
E024,E,Return to Sender,Return target Expeditor Card to its owner's hand.,The expeditor proactively resolves an error before it causes a delay.,Self,Single,Any,,,Apply Card,Immediate,,,,,,,,,,,,,,,,,,,1,1,,,,,,,,,,Immediate,,,All Colors,,,Common,Low,,
E029,E,Weekend Work,Reduce the current filing time by 3 ticks but skip your next turn.,Working over the weekend gets it done faster but postpones other tasks.,Self,Single,Any,,,Apply Card,Immediate,,,,,,-3,,,Skip next turn,,,,,,,,,1,1,,,,,,,,,,Immediate,,,All Colors,,,Common,Low,,
E030,E,Time Crunch,Skip your next turn. Then reduce your current filing time by 5 ticks.,The expeditor works extraordinarily hard now to free up time later.,Self,Single,Any,,,Apply Card,Immediate,,,,,,-5,,,Skip next turn,,,,,,,,,1,1,,,,,,,,,,Immediate,,,All Colors,,,Common,Low,,
E032,E,Team Effort,You and target player each reduce your current filing times by 2 ticks then discard 1 Expeditor Card.,Collaborating with another expeditor proves mutually beneficial.,Self,Single,Any,,,Apply Card,Immediate,,,,,,,-2,,,,,1,,,,,,,1,1,,,,,,,,,,Immediate,,,All Colors,,,Common,Low,,
E037,E,Expeditor Mentor,Reduce the current filing time by 1 tick for each Expeditor Card played this turn.,Learning from a senior expeditor compounds the time savings.,Self,Single,Any,,,Apply Card,Immediate,,,,,,-1,,,,,,,,,,,,1,1,,,,,,,,,,Immediate,,,All Colors,,,Common,Low,,
E038,E,Surge Pricing,Pay three junior expeditors ($3000) to reduce the current filing time by 3 ticks.,Rush jobs come at a premium but can be worth it.,Self,Single,Any,,,Apply Card,Immediate,,,,-3000,,-3,,,,,,,,,,,,1,1,,,,,,,,,,Immediate,,,All Colors,,,Common,Low,,
E041,E,Process Improvement,Reduce your current filing time by 6 ticks.,The expeditor discovers a way to optimize the filing process.,Self,Single,Any,,,Apply Card,Immediate,,,,,,-6,,,,,,,,,,,,1,1,,,,,,,,,,Immediate,,,All Colors,,,Common,Low,,
E046,E,Expeditor's Assistant,Reduce the current filing time by 1 tick. Draw 1 Expeditor Card.,An assistant expeditor helps with routine tasks freeing up time for the lead expeditor.,Self,Single,Any,,,Apply Card,Immediate,,,,,,-1,,,,,1,,,,,,,,1,1,,,,,,,,,,Immediate,,,All Colors,,,Common,Low,,
E047,E,Final Push,Reduce the time for the final inspection by 3 ticks.,Your expeditor pulls an all-nighter to ensure everything is perfect for the final inspection.,Self,Single,CONSTRUCTION,,,Apply Card,Immediate,,,,,,-3,,,,,,,,,,,,1,1,,,,,,,,,,Immediate,,,Purple,,,Common,Low,,
E048,E,Streamlined Closeout,Reduce the time for project closeout paperwork by 2 ticks and draw 1 Expeditor Card.,Your expeditor's meticulous record-keeping pays off making the final paperwork a breeze.,Self,Single,CONSTRUCTION,,,Apply Card,Immediate,,,,,,-2,,,,,1,,,,,,,,1,1,,,,,,,,,,Immediate,,,Purple,,,Common,Low,,
E049,E,Safety Inspection Prep,Reduce time for next safety inspection by 2 ticks.,Your expeditor's thorough preparation ensures a smooth inspection process.,Self,Single,CONSTRUCTION,,,Apply Card,Immediate,,,,,,-2,,,,,,,,,,,,1,1,,,,,,,,,,Immediate,,,Purple,,,Common,Low,,
E050,E,Equipment Rush Order,Pay $2000 to reduce construction time by 4 ticks.,Your expeditor leverages connections to get critical equipment delivered faster.,Self,Single,CONSTRUCTION,,,Apply Card,Immediate,,,,-2000,,-4,,,,,,,,,,,,1,1,,,,,,,,,,Immediate,,,Purple,,,Common,Low,,
E051,E,Permit Extension,Extend current construction permit by 10 ticks.,Your expeditor secures a last-minute extension on a nearly expired permit.,Self,Single,CONSTRUCTION,,,Apply Card,Immediate,,,,,,10,,,,,,,,,,,,1,1,,,,,,,,,,Immediate,,,Purple,,,Common,Low,,
E052,E,Site Logistics Optimization,Reduce construction time by 3 ticks.,Your expeditor reorganizes the construction site for maximum efficiency.,Self,Single,CONSTRUCTION,,,Apply Card,Immediate,,,,,,-3,,,,,,,,,,,,1,1,,,,,,,,,,Immediate,,,Purple,,,Common,Low,,
E053,E,Overtime Approval,Pay $3000 to reduce construction time by 6 ticks.,Your expeditor negotiates approval for extended work hours.,Self,Single,CONSTRUCTION,,,Apply Card,Immediate,,,,-3000,,-6,,,,,,,,,,,,1,1,,,,,,,,,,Immediate,,,Purple,,,Common,Low,,
E054,E,Inspection Scheduling,Advance your place in the inspection queue by 5 ticks.,Your expeditor's persistence secures an earlier inspection slot.,Self,Single,CONSTRUCTION,,,Apply Card,Immediate,,,,,,-5,,,,,,,,,,,,1,1,,,,,,,,,,Immediate,,,Purple,,,Common,Low,,
E055,E,Change Order Expedite,Reduce time for processing a change order by 3 ticks.,Your expeditor fast-tracks a critical change order through the system.,Self,Single,CONSTRUCTION,,,Apply Card,Immediate,,,,,,-3,,,,,,,,,,,,1,1,,,,,,,,,,Immediate,,,Purple,,,Common,Low,,
E056,E,Weather Mitigation Plan,Prevent a 2-tick delay due to adverse weather conditions.,Your expeditor's foresight in weather planning keeps the project on track.,Self,Single,CONSTRUCTION,,,Apply Card,Immediate,,,,,,2,,,,,,,,,,,,1,1,,,,,,,,,,Immediate,,,Purple,,,Common,Low,,
E028,E,Fact Checking,Skip this turn. Reduce the current filing time by 4 ticks.,Time spent upfront verifying information saves time later.,Self,Single,DESIGN,,,Apply Card,Immediate,,,,,,-4,,,Skip this turn,,,,,,,,,1,1,,,,,,,,,,Immediate,,,Yellow,,,Common,Low,,
E045,E,Permit Pre-Approval,Choose a permit type. The current permit filing of that type takes 4 ticks less time.,Advance approval streamlines the actual permit filing process.,Choose Opponent,Single,DESIGN,,,Apply Card,Immediate,,,,,,,-4,,,,,,,,,,,,1,1,,,,,,,,,,Immediate,,,Yellow,,,Common,Low,,
E057,E,Zoning Variance Fast Track,Reduce time for zoning variance approval by 4 ticks.,Your expeditor's knowledge of local zoning laws speeds up the process.,Self,Single,DESIGN,,,Apply Card,Immediate,,,,,,,,,,,,,,,,,,,1,1,,,,,,,,,,Immediate,,,Yellow,,,Common,Low,,
E058,E,Design Team Coordination,Reduce design phase time by 3 ticks.,Your expeditor facilitates smoother communication between design team members.,Self,Single,DESIGN,,,Apply Card,Immediate,,,,,,-3,,,,,,,,,,,,1,1,,,,,,,,,,Immediate,,,Yellow,,,Common,Low,,
E059,E,Code Compliance Review,Prevent a potential 3-tick delay from code violations.,Your expeditor's thorough review catches potential issues early.,Self,Single,DESIGN,,,Apply Card,Immediate,,,,,,3,,,,,,,,,,,,1,1,,,,,,,,,,Immediate,,,Yellow,,,Common,Low,,
E060,E,Sustainable Design Incentive,Reduce design time by 2 ticks for incorporating green features.,Your expeditor secures fast-track processing for sustainable designs.,Self,Single,DESIGN,,,Apply Card,Immediate,,,,,,-2,,,,,,,,,,,,1,1,,,,,,,,,,Immediate,,,Yellow,,,Common,Low,,
E061,E,Historic Preservation Consult,Reduce design review time by 3 ticks for projects in historic districts.,Your expeditor's expertise in historical regulations proves invaluable.,Self,Single,DESIGN,,,Apply Card,Immediate,,,,,,-3,,,,,,,,,,,,1,1,,,,,,,,,,Immediate,,,Yellow,,,Common,Low,,
E062,E,BIM Integration,Reduce overall design time by 4 ticks.,Your expeditor implements Building Information Modeling to streamline the design process.,Self,Single,DESIGN,,,Apply Card,Immediate,,,,,,-4,,,,,,,,,,,,1,1,,,,,,,,,,Immediate,,,Yellow,,,Common,Low,,
E063,E,Value Engineering Session,Reduce design costs by $2000 and design time by 2 ticks.,Your expeditor organizes a productive value engineering workshop.,Self,Single,DESIGN,,,Apply Card,Immediate,,,,2000,,-2,,,,,,,,,,,,1,1,,,,,,,,,,Immediate,,,Yellow,,,Common,Low,,
E064,E,Peer Review Acceleration,Reduce peer review process time by 3 ticks.,Your expeditor arranges for an expedited peer review of the design.,Self,Single,DESIGN,,,Apply Card,Immediate,,,,,,-3,,,,,,,,,,,,1,1,,,,,,,,,,Immediate,,,Yellow,,,Common,Low,,
E065,E,Grant Application Expedite,Reduce time for grant application processing by 3 ticks.,Your expeditor's knowledge of grant requirements speeds up the process.,Self,Single,FUNDING,,,Apply Card,Immediate,,,,,,-3,,,,,,,,,,,,1,1,,,,,,,,,,Immediate,,,Green,,,Common,Low,,
E066,E,Investor Pitch Preparation,Gain 1 extra die throw this turn if you do not like the outcome of first throw.,Your expeditor helps craft a compelling presentation for potential investors.,Self,Single,FUNDING,,,Apply Card,Immediate,,,,,,,,,,,,,,,,,,,1,1,,,,,,,,,,Immediate,,,Green,,,Common,Low,,
E067,E,Tax Incentive Research,Reduce project costs by 10% through identified tax incentives.,Your expeditor uncovers applicable tax incentives for the project.,Self,Single,FUNDING,,,Apply Card,Immediate,,,,,0.1,,,,,,,,,,,,1,1,,,,,,,,,,Immediate,,,Green,,,Common,Low,,
E068,E,Loan Approval Acceleration,Reduce loan approval time by 4 ticks.,Your expeditor's relationship with lenders helps speed up the approval process.,Self,Single,FUNDING,,,Apply Card,Immediate,,,,,,-4,,,,,,,,,,,,1,1,,,,,,,,,,Immediate,,,Green,,,Common,Low,,
E069,E,Crowdfunding Campaign Boost,Gain an extra $10000 in funding this turn.,Your expeditor's social media savvy gives your crowdfunding campaign a boost.,Self,Single,FUNDING,,,Apply Card,Immediate,,,,10000,,,,,,,,,,,,,,1,1,,,,,,,,,,Immediate,,,Green,,,Common,Low,,
E070,E,Escrow Resolution,Release $5000 from escrow immediately.,Your expeditor navigates complex escrow requirements to free up funds.,Self,Single,FUNDING,,,Apply Card,Immediate,,,,5000,,,,,,,,,,,,,,1,1,,,,,,,,,,Immediate,,,Green,,,Common,Low,,
E071,E,Capital Stack Optimization,Reduce interest payments by $2000.,Your expeditor restructures the project's capital stack for better terms.,Self,Single,FUNDING,,,Apply Card,Immediate,,,,2000,,,,,,,,,,,,,,1,1,,,,,,,,,,Immediate,,,Green,,,Common,Low,,
E072,E,Brownfield Remediation Fund,Secure an additional $4000 for site cleanup.,Your expeditor identifies and secures special funding for contaminated site development.,Self,Single,FUNDING,,,Apply Card,Immediate,,,,4000,,,,,,,,,,,,,,1,1,,,,,,,,,,Immediate,,,Green,,,Common,Low,,
E073,E,Historic Tax Credit Application,Reduce renovation costs by $3000 for qualifying historic buildings.,Your expeditor navigates the complex process of applying for historic tax credits.,Self,Single,FUNDING,,,Apply Card,Immediate,,,,3000,,,,,,,,,,,,,,1,1,,,,,,,,,,Immediate,,,Green,,,Common,Low,,
E074,E,Public-Private Partnership,Secure $5000 in public funds for the project.,Your expeditor brokers a beneficial public-private partnership agreement.,Self,Single,FUNDING,,,Apply Card,Immediate,,,,5000,,,,,,,,,,,,,,1,1,,,,,,,,,,Immediate,,,Green,,,Common,Low,,
E005,E,Rush Processing,Complete the current filing immediately skipping up to 5 ticks.,Your expeditor pulls some strings to get your filing processed ASAP.,Self,Single,REGULATORY_REVIEW,,,Apply Card,Immediate,,,,,,-5,,,,,,,,,,,,1,1,,,,,,,,,,Immediate,,,,,,,Common,Low,
E007,E,Expeditor's Insight,Draw 2 Expeditor Cards then discard 1 Expeditor Card.,Your expeditor provides valuable guidance helping you make informed decisions.,Self,Single,REGULATORY_REVIEW,,,Apply Card,Immediate,,,,,,,,,,,2,,,,,,,,1,1,,,,,,,,,,Immediate,,,,,,,Common,Low,
E009,E,Favor Called In,Choose an opponent. Their current filing takes 2 ticks more time. your current filing takes 2 ticks less time.,Your expeditor calls in a favor impacting both you and your rival.,Choose Opponent,Single,REGULATORY_REVIEW,,,Apply Card,Immediate,,,,,,,2,,,,,,,,,,,,1,1,,,,,,,,,,Immediate,,,,,,,Common,Low,
E011,E,Permit Expedited,Roll a die. On 1-3 reduce processing time by 4 ticks. On 4-6 no effect.,Your expeditor greases the wheels to get your permit fast-tracked.,Self,Single,REGULATORY_REVIEW,,,Apply Card,Immediate,,,,,,,,,,,,,,,,,,,1,1,,,,,,,,,,Immediate,,,,,,,Common,Low,
E016,E,Routine Procedure,Roll a die. On 1-3 the last filing was the same type; reduce the current filing time by 1 tick. On 4-6 no effect.,Familiarity with the process leads to a small time reduction.,Self,Single,REGULATORY_REVIEW,,,Apply Card,Immediate,,,,,,,,,,,,,,,,,,,1,1,,,,,,,,,,Immediate,,,,,,,Common,Low,
E023,E,On the Radar,Roll a die. On 1-3 the current filing is for a high-profile client; reduce its time by 2 ticks. On 4-6 no effect.,The expeditor prioritizes the filing knowing that important people are watching.,Self,Single,REGULATORY_REVIEW,,,Apply Card,Immediate,,,,,,-2,,,On Play,Roll die: 1-3 reduce time by 2,,,,,,,,,1,1,,,,,,,,,,Immediate,,,Red,,,Common,Low,,
E026,E,Benefit Verification,Roll a die. On 1-3 reduce your current filing time by 2 ticks. On 4-6 no effect.,Consistent filing types enable shortcuts in the process.,Self,Single,REGULATORY_REVIEW,,,Apply Card,Immediate,,,,,,-2,,,On Play,Roll die: 1-3 reduce time by 2,,,,,,,,,1,1,,,,,,,,,,Immediate,,,Red,,,Common,Low,,
E033,E,Audit Preparation,Roll a die. On 1-3 reduce your current filing time by 2 ticks. On 4-6 increase your current filing time by 2 ticks.,Proactive preparation for an audit takes time but pays off.,Self,Single,REGULATORY_REVIEW,,,Apply Card,Immediate,,,,,,,,,,,,,,,,,,,1,1,,,,,,,,,,Immediate,,,Red,,,Common,Low,,
E036,E,Press Release,If the current client is high-profile reduce the filing time by 3 ticks.,Announcing the filing to the media puts pressure on officials to expedite.,Self,Single,REGULATORY_REVIEW,,,Apply Card,Immediate,,,,,,,,,,,,,,,,,,,1,1,,,,,,,,,,Immediate,,,Red,,,Common,Low,,
E040,E,Bulk Discount,If 3+ permits are filed this turn,reduce their filing times by 1 tick each.,Self,Single,REGULATORY_REVIEW,,,Apply Card,Immediate,,,,,,,,,,,,,,,,,,,1,1,,,,,,,,,,Immediate,,,The expeditor secures a discount for handling multiple permits at once.,,,Common,Low,,
E044,E,Appeal Process,If your filing was previously rejected,reduce the current filing time by 3 ticks.,Self,Single,REGULATORY_REVIEW,,,Apply Card,Immediate,,,,,,,,,,,,,,,,,,,1,1,,,,,,,,,,Immediate,,,The expeditor's quick appeal gets the filing back on track.,,,Common,Low,,
E001,E,Expedited Review,The current review phase takes 1 tick less time.,Your expeditor calls in a favor to get your filing moved to the top of the review pile.,Self,Single,REGULATORY_REVIEW,,,Apply Card,Immediate,,,,,,,-1,,,,,,,,,,,,1,1,,,,,,,,,,Immediate,,,Red,,,Common,Low,,
E002,E,Filing Error,Increase the time for the current filing by 3 ticks.,A small mistake by the expeditor leads to your filing being returned for corrections.,Self,Single,REGULATORY_REVIEW,,,Apply Card,Immediate,,,,,,3,,,,,,,,,,,,1,1,,,,,,,,,,Immediate,,,Red,,,Common,Low,,
E003,E,Efficiency Boost,Reduce your current filing time by 3 ticks.,Your expeditor streamlines the filing process improving overall efficiency.,Self,Single,REGULATORY_REVIEW,,,Apply Card,Immediate,,,,,,-3,,,,,,,,,,,,1,1,,,,,,,,,,Immediate,,,Red,,,Common,Low,,
E004,E,Extended Wait Time,Increase your current filing time by 4 ticks.,Your usual expeditor is out sick resulting in unexpected delays.,Self,Single,REGULATORY_REVIEW,,,Apply Card,Immediate,,,,,,4,,,,,,,,,,,,1,1,,,,,,,,,,Immediate,,,Red,,,Common,Low,,
E006,E,Regulatory Slowdown,Your current filing takes 2 ticks more time.,New regulations create additional red tape slowing down your expeditor.,Self,Single,REGULATORY_REVIEW,,,Apply Card,Immediate,,,,,,,2,,,,,,,,,,,,1,1,,,,,,,,,,Immediate,,,Red,,,Common,Low,,
E010,E,Batch Processing,Reduce your current filing time by 2 ticks.,Your expeditor finds a way to process multiple filings together.,Self,Single,REGULATORY_REVIEW,,,Apply Card,Immediate,,,,,,-2,,,,,,,,,,,,1,1,,,,,,,,,,Immediate,,,Red,,,Common,Low,,
E012,E,Paperwork Snag,Discard 1 Expeditor Card or the current filing takes 1 tick more time.,A paperwork issue threatens to delay the filing.,Self,Single,REGULATORY_REVIEW,,,Apply Card,Immediate,,,,,,1,,,,,1,,,,,,,1,1,,,,,,,,,,Immediate,,,Red,,,Common,Low,,
E013,E,Redundant Requests,All players' current filing takes 2 ticks more time.,Multiple expeditors accidentally submit the same filing causing confusion.,All Players,Global,REGULATORY_REVIEW,,,Apply Card,Immediate,,,,,,,2,,,,,,,,,,,,1,1,,,,,,,,,,Immediate,,,Red,,,Common,Low,,
E014,E,Express Delivery,Reduce the current filing time by 2 ticks but skip your next turn.,You pay for express delivery but it throws off your schedule.,Self,Single,REGULATORY_REVIEW,,,Apply Card,Immediate,,,,,,-2,,,Skip next turn,,,,,,,,,1,1,,,,,,,,,,Immediate,,,Red,,,Common,Low,,
E015,E,Canceled Appointment,Increase the current filing time by 1 tick and draw 1 Expeditor Card.,A canceled meeting with an official delays the filing but provides time to prepare.,Self,Single,REGULATORY_REVIEW,,,Apply Card,Immediate,,,,,,1,,,,,1,,,,,,,,1,1,,,,,,,,,,Immediate,,,Red,,,Common,Low,,
E017,E,Double Check,Pay a junior expeditor ($1000) to reduce the chance of a random filing error by 50% this turn.,Taking time to thoroughly review the filing now can prevent issues later.,Self,Single,REGULATORY_REVIEW,,,Apply Card,Immediate,,,,-1000,,,,,,,,,,,,,,,1,1,,,,,,,,,,Immediate,,,Red,,,Common,Low,,
E018,E,Inside Connection,Reduce the current filing time by 2 ticks.,Who you know can make all the difference in getting things expedited.,Self,Single,REGULATORY_REVIEW,,,Apply Card,Immediate,,,,,,-2,,,,,,,,,,,,1,1,,,,,,,,,,Immediate,,,Red,,,Common,Low,,
E019,E,Complex Filing,Increase the current filing time by 4 ticks but pay two subject matter experts ($4000).,The expeditor handles an especially complex filing but charges extra.,Self,Single,REGULATORY_REVIEW,,,Apply Card,Immediate,,,,-4000,,4,,,,,,,,,,,,,1,1,,,,,,,,,,Immediate,,,Red,,,Common,Low,,
E021,E,Delayed Expeditor,Increase your current filing time by 4 ticks.,Your usual expeditor is temporarily reassigned causing delays.,Self,Single,REGULATORY_REVIEW,,,Apply Card,Immediate,,,,,,4,,,,,,,,,,,,1,1,,,,,,,,,,Immediate,,,Red,,,Common,Low,,
E022,E,Expeditor Lunch Meeting,Reduce your current filing time by 1 tick and the next player's current filing time by 1 tick.,Productive discussion over lunch benefits both parties' filings.,Self,Single,REGULATORY_REVIEW,,,Apply Card,Immediate,,,,,,-1,,,,,,,,,,,,1,1,,,,,,,,,,Immediate,,,Red,,,Common,Low,,
E025,E,Red Tape Reduction,Your current filing takes 1 tick less time.,A regulatory change temporarily reduces bureaucratic hurdles.,Self,Single,REGULATORY_REVIEW,,,Apply Card,Immediate,,,,,,,-1,,,,,,,,,,,,1,1,,,,,,,,,,Immediate,,,Red,,,Common,Low,,
