card_id,card_type,card_name,description,flavor_text,target,scope,phase_restriction,space_restriction,work_type_restriction,immediate_effect,duration,duration_count,turn_effect,money_cost,money_effect,percentage_effect,time_effect,tick_modifier,dice_trigger,dice_effect,conditional_logic,draw_cards,discard_cards,card_type_filter,movement_effect,space_effect,inspection_effect,player_state_check,game_state_check,stacking_limit,usage_limit,cooldown,combo_requirement,prerequisite,priority,queue_effect,loan_amount,loan_rate,investment_amount,work_cost,activation_timing,chain_effect,nullify_effect,environmental_factor,social_factor,political_factor,rarity,distribution_level,,
B001,B,Small Business Loan,Low interest loan for initial funding,Perfect for entrepreneurs ready to turn their vision into reality.,Self,Single,Any,,,Apply Loan,Permanent,,,,,,,,,,,,,,,,,,,1,1,,,,,,500000,5,,,Immediate,,,,,,Common,Low,,
B002,B,Startup Capital Loan,Low interest loan for initial project expenses,Every great project starts with the right financial foundation.,Self,Single,Any,,,Apply Loan,Permanent,,,,,,,,,,,,,,,,,,,1,1,,,,,,600000,5,,,Immediate,,,,,,Common,Low,,
B003,B,New Venture Loan,Low interest loan for growing projects,Fuel your expansion with competitive rates and flexible terms.,Self,Single,Any,,,Apply Loan,Permanent,,,,,,,,,,,,,,,,,,,1,1,,,,,,700000,5,,,Immediate,,,,,,Common,Low,,
B004,B,Small Building Fund,Low interest loan for small construction projects,Building dreams one brick at a time with affordable financing.,Self,Single,Any,,,Apply Loan,Permanent,,,,,,,,,,,,,,,,,,,1,1,,,,,,800000,5,,,Immediate,,,,,,Common,Low,,
B005,B,Retail Space Loan,Low interest loan for retail development,Creating vibrant retail spaces that bring communities together.,Self,Single,Any,,,Apply Loan,Permanent,,,,,,,,,,,,,,,,,,,1,1,,,,,,900000,5,,,Immediate,,,,,,Common,Low,,
B006,B,Office Project Loan,Low interest loan for office renovation,Modern workspaces deserve modern financing solutions.,Self,Single,Any,,,Apply Loan,Permanent,,,,,,,,,,,,,,,,,,,1,1,,,,,,1000000,5,,,Immediate,,,,,,Common,Low,,
B007,B,Residential Renovation Loan,Low interest loan for residential renovation,Transform houses into homes with our renovation financing.,Self,Single,Any,,,Apply Loan,Permanent,,,,,,,,,,,,,,,,,,,1,1,,,,,,1100000,5,,,Immediate,,,,,,Common,Low,,
B008,B,Commercial Space Loan,Low interest loan for commercial properties,Powering commerce with strategic property financing.,Self,Single,Any,,,Apply Loan,Permanent,,,,,,,,,,,,,,,,,,,1,1,,,,,,1200000,5,,,Immediate,,,,,,Common,Low,,
B009,B,Small Multifamily Loan,Low interest loan for small multifamily projects,Building communities through affordable housing development.,Self,Single,Any,,,Apply Loan,Permanent,,,,,,,,,,,,,,,,,,,1,1,,,,,,1300000,5,,,Immediate,,,,,,Common,Low,,
B010,B,Mixed-Use Development Loan,Low interest loan for mixed-use development,Where living meets working - financing the future of urban development.,Self,Single,Any,,,Apply Loan,Permanent,,,,,,,,,,,,,,,,,,,1,1,,,,,,1400000,5,,,Immediate,,,,,,Common,Low,,
B011,B,Community Bank Loan,Low interest loan from community bank,Local banks understand local needs and opportunities.,Self,Single,Any,,,Apply Loan,Permanent,,,,,,,,,,,,,,,,,,,1,1,,,,,,500000,5,,,Immediate,,,,,,Common,Low,,
B012,B,Local Developer Funding,Low interest loan from local development group,When developers invest in developers - the community wins.,Self,Single,Any,,,Apply Loan,Permanent,,,,,,,,,,,,,,,,,,,1,1,,,,,,600000,5,,,Immediate,,,,,,Common,Low,,
B013,B,Family Office Investment,Low interest funding from family office,Multi-generational wealth seeks lasting value in real estate.,Self,Single,Any,,,Apply Loan,Permanent,,,,,,,,,,,,,,,,,,,1,1,,,,,,700000,5,,,Immediate,,,,,,Common,Low,,
B014,B,Private Lender Loan,Low interest financing from private lender,Sometimes the best deals come from unexpected sources.,Self,Single,Any,,,Apply Loan,Permanent,,,,,,,,,,,,,,,,,,,1,1,,,,,,800000,5,,,Immediate,,,,,,Common,Low,,
B015,B,Small Business Administration Loan,Low interest SBA backed loan,Government-backed financing opens doors to entrepreneurial dreams.,Self,Single,Any,,,Apply Loan,Permanent,,,,,,,,,,,,,,,,,,,1,1,,,,,,900000,5,,,Immediate,,,,,,Common,Low,,
B016,B,Local Credit Union Financing,Low interest credit union loan,,Self,Single,Any,,,Apply Loan,Permanent,,,,,,,,,,,,,,,,,,,1,1,,,,,,1000000,5,,,Immediate,,,,,,Common,Low,,
B017,B,Regional Bank Loan,Low interest regional bank financing,,Self,Single,Any,,,Apply Loan,Permanent,,,,,,,,,,,,,,,,,,,1,1,,,,,,1100000,5,,,Immediate,,,,,,Common,Low,,
B018,B,Project Seed Funding,Low interest early project funding,,Self,Single,Any,,,Apply Loan,Permanent,,,,,,,,,,,,,,,,,,,1,1,,,,,,1200000,5,,,Immediate,,,,,,Common,Low,,
B019,B,Hometown Bank Loan,Low interest hometown bank loan,,Self,Single,Any,,,Apply Loan,Permanent,,,,,,,,,,,,,,,,,,,1,1,,,,,,1300000,5,,,Immediate,,,,,,Common,Low,,
B020,B,Neighborhood Development Loan,Low interest neighborhood development financing,,Self,Single,Any,,,Apply Loan,Permanent,,,,,,,,,,,,,,,,,,,1,1,,,,,,1400000,5,,,Immediate,,,,,,Common,Low,,
B021,B,Facade Improvement Loan,Low interest loan for building facade updates,,Self,Single,Any,,,Apply Loan,Permanent,,,,,,,,,,,,,,,,,,,1,1,,,,,,500000,5,,,Immediate,,,,,,Common,Low,,
B022,B,Historic Preservation Loan,Low interest historic building renovation loan,,Self,Single,Any,,,Apply Loan,Permanent,,,,,,,,,,,,,,,,,,,1,1,,,,,,600000,5,,,Immediate,,,,,,Common,Low,,
B023,B,Green Building Incentive Loan,Low interest loan for sustainable building features,,Self,Single,Any,,,Apply Loan,Permanent,,,,,,,,,,,,,,,,,,,1,1,,,,,,700000,5,,,Immediate,,,,,,Common,Low,,
B024,B,Brownfield Redevelopment Loan,Low interest loan for brownfield site cleanup and development,,Self,Single,Any,,,Apply Loan,Permanent,,,,,,,,,,,,,,,,,,,1,1,,,,,,800000,5,,,Immediate,,,,,,Common,Low,,
B025,B,Main Street Revitalization Loan,Low interest loan for main street property improvements,,Self,Single,Any,,,Apply Loan,Permanent,,,,,,,,,,,,,,,,,,,1,1,,,,,,900000,5,,,Immediate,,,,,,Common,Low,,
B026,B,Urban Infill Development Loan,Low interest loan for urban infill projects,,Self,Single,Any,,,Apply Loan,Permanent,,,,,,,,,,,,,,,,,,,1,1,,,,,,1000000,5,,,Immediate,,,,,,Common,Low,,
B027,B,Affordable Housing Loan,Low interest loan for affordable housing components,,Self,Single,Any,,,Apply Loan,Permanent,,,,,,,,,,,,,,,,,,,1,1,,,,,,1100000,5,,,Immediate,,,,,,Common,Low,,
B028,B,Mixed-Income Development Loan,Low interest loan for mixed-income projects,,Self,Single,Any,,,Apply Loan,Permanent,,,,,,,,,,,,,,,,,,,1,1,,,,,,1200000,5,,,Immediate,,,,,,Common,Low,,
B029,B,Transit-Oriented Development Loan,Low interest loan for transit-adjacent development,,Self,Single,Any,,,Apply Loan,Permanent,,,,,,,,,,,,,,,,,,,1,1,,,,,,1300000,5,,,Immediate,,,,,,Common,Low,,
B030,B,Adaptive Reuse Loan,Low interest loan for adaptive reuse projects,,Self,Single,Any,,,Apply Loan,Permanent,,,,,,,,,,,,,,,,,,,1,1,,,,,,1400000,5,,,Immediate,,,,,,Common,Low,,
B031,B,Mid-Size Development Loan,Medium interest loan for larger development projects,,Self,Single,Any,,,Apply Loan,Permanent,,,,,,,,,,,,,,,,,,,1,1,,,,,,1500000,10,,,Immediate,,,,,,Common,Medium,,
B032,B,Commercial Construction Loan,Medium interest loan for commercial construction,,Self,Single,Any,,,Apply Loan,Permanent,,,,,,,,,,,,,,,,,,,1,1,,,,,,1750000,10,,,Immediate,,,,,,Common,Medium,,
B033,B,Mid-Market Office Loan,Medium interest loan for office building development,,Self,Single,Any,,,Apply Loan,Permanent,,,,,,,,,,,,,,,,,,,1,1,,,,,,2000000,10,,,Immediate,,,,,,Common,Medium,,
B034,B,Community Center Financing,Medium interest loan for community center construction,,Self,Single,Any,,,Apply Loan,Permanent,,,,,,,,,,,,,,,,,,,1,1,,,,,,2250000,10,,,Immediate,,,,,,Common,Medium,,
B035,B,Mid-Size Retail Complex Loan,Medium interest loan for retail development,,Self,Single,Any,,,Apply Loan,Permanent,,,,,,,,,,,,,,,,,,,1,1,,,,,,2500000,10,,,Immediate,,,,,,Common,Medium,,
B036,B,Multifamily Housing Loan,Medium interest loan for multifamily housing,,Self,Single,Any,,,Apply Loan,Permanent,,,,,,,,,,,,,,,,,,,1,1,,,,,,2750000,10,,,Immediate,,,,,,Common,Medium,,
B037,B,Class B Office Renovation Loan,Medium interest loan for Class B office renovation,,Self,Single,Any,,,Apply Loan,Permanent,,,,,,,,,,,,,,,,,,,1,1,,,,,,1500000,10,,,Immediate,,,,,,Common,Medium,,
B038,B,Mid-Market Hotel Loan,Medium interest loan for hotel development,,Self,Single,Any,,,Apply Loan,Permanent,,,,,,,,,,,,,,,,,,,1,1,,,,,,1750000,10,,,Immediate,,,,,,Common,Medium,,
B039,B,Medical Office Building Loan,Medium interest loan for medical office space,,Self,Single,Any,,,Apply Loan,Permanent,,,,,,,,,,,,,,,,,,,1,1,,,,,,2000000,10,,,Immediate,,,,,,Common,Medium,,
B040,B,Professional Office Building Loan,Medium interest loan for professional offices,,Self,Single,Any,,,Apply Loan,Permanent,,,,,,,,,,,,,,,,,,,1,1,,,,,,2250000,10,,,Immediate,,,,,,Common,Medium,,
B041,B,Shopping Plaza Loan,Medium interest loan for shopping plaza development,,Self,Single,Any,,,Apply Loan,Permanent,,,,,,,,,,,,,,,,,,,1,1,,,,,,2500000,10,,,Immediate,,,,,,Common,Medium,,
B042,B,Restaurant Development Loan,Medium interest loan for restaurant space,,Self,Single,Any,,,Apply Loan,Permanent,,,,,,,,,,,,,,,,,,,1,1,,,,,,2750000,10,,,Immediate,,,,,,Common,Medium,,
B043,B,Warehouse Conversion Loan,Medium interest loan for warehouse conversions,,Self,Single,Any,,,Apply Loan,Permanent,,,,,,,,,,,,,,,,,,,1,1,,,,,,1500000,10,,,Immediate,,,,,,Common,Medium,,
B044,B,Industrial Park Loan,Medium interest loan for industrial park development,,Self,Single,Any,,,Apply Loan,Permanent,,,,,,,,,,,,,,,,,,,1,1,,,,,,1750000,10,,,Immediate,,,,,,Common,Medium,,
B045,B,Entertainment Venue Loan,Medium interest loan for entertainment venues,,Self,Single,Any,,,Apply Loan,Permanent,,,,,,,,,,,,,,,,,,,1,1,,,,,,2000000,10,,,Immediate,,,,,,Common,Medium,,
B046,B,Sports Facility Loan,Medium interest loan for sports facilities,,Self,Single,Any,,,Apply Loan,Permanent,,,,,,,,,,,,,,,,,,,1,1,,,,,,2250000,10,,,Immediate,,,,,,Common,Medium,,
B047,B,Assisted Living Facility Loan,Medium interest loan for assisted living development,,Self,Single,Any,,,Apply Loan,Permanent,,,,,,,,,,,,,,,,,,,1,1,,,,,,2500000,10,,,Immediate,,,,,,Common,Medium,,
B048,B,Education Building Loan,Medium interest loan for educational facilities,,Self,Single,Any,,,Apply Loan,Permanent,,,,,,,,,,,,,,,,,,,1,1,,,,,,2750000,10,,,Immediate,,,,,,Common,Medium,,
B049,B,Cultural Center Loan,Medium interest loan for cultural centers,,Self,Single,Any,,,Apply Loan,Permanent,,,,,,,,,,,,,,,,,,,1,1,,,,,,1500000,10,,,Immediate,,,,,,Common,Medium,,
B050,B,Tourism Development Loan,Medium interest loan for tourism-related projects,,Self,Single,Any,,,Apply Loan,Permanent,,,,,,,,,,,,,,,,,,,1,1,,,,,,1750000,10,,,Immediate,,,,,,Common,Medium,,
B051,B,Major Project Financing,High interest loan for major development projects,,Self,Single,Any,,,Apply Loan,Permanent,,,,,,,,,,,,,,,,,,,1,1,,,,,,3000000,15,,,Immediate,,,,,,Common,High,,
B052,B,Luxury Development Loan,High interest loan for luxury real estate development,,Self,Single,Any,,,Apply Loan,Permanent,,,,,,,,,,,,,,,,,,,1,1,,,,,,3250000,15,,,Immediate,,,,,,Common,High,,
B053,B,Class A Office Building Loan,High interest loan for Class A office construction,,Self,Single,Any,,,Apply Loan,Permanent,,,,,,,,,,,,,,,,,,,1,1,,,,,,3500000,15,,,Immediate,,,,,,Common,High,,
B054,B,Mixed-Use Tower Financing,High interest loan for high-rise mixed-use development,,Self,Single,Any,,,Apply Loan,Permanent,,,,,,,,,,,,,,,,,,,1,1,,,,,,3750000,15,,,Immediate,,,,,,Common,High,,
B055,B,Urban Mega-Project Loan,High interest loan for urban mega-projects,,Self,Single,Any,,,Apply Loan,Permanent,,,,,,,,,,,,,,,,,,,1,1,,,,,,4000000,15,,,Immediate,,,,,,Common,High,,
B056,B,High-Rise Condominium Loan,High interest loan for high-rise condominiums,,Self,Single,Any,,,Apply Loan,Permanent,,,,,,,,,,,,,,,,,,,1,1,,,,,,3000000,15,,,Immediate,,,,,,Common,High,,
B057,B,Major Retail Development Loan,High interest loan for major retail centers,,Self,Single,Any,,,Apply Loan,Permanent,,,,,,,,,,,,,,,,,,,1,1,,,,,,3250000,15,,,Immediate,,,,,,Common,High,,
B058,B,Convention Center Loan,High interest loan for convention center development,,Self,Single,Any,,,Apply Loan,Permanent,,,,,,,,,,,,,,,,,,,1,1,,,,,,3500000,15,,,Immediate,,,,,,Common,High,,
B059,B,Airport Expansion Loan,High interest loan for airport-related development,,Self,Single,Any,,,Apply Loan,Permanent,,,,,,,,,,,,,,,,,,,1,1,,,,,,3750000,15,,,Immediate,,,,,,Common,High,,
B060,B,Stadium Development Loan,High interest loan for stadium projects,,Self,Single,Any,,,Apply Loan,Permanent,,,,,,,,,,,,,,,,,,,1,1,,,,,,4000000,15,,,Immediate,,,,,,Common,High,,
I001,I,Investment: Local real estate developer seeking to diversify portfolio,Local real estate developer seeking to diversify portfolio,"Sometimes the best investment is in your own neighborhood.",Self,Single,Any,,,Apply Investment,Permanent,,,,,,,,,,,,,,,,,,,1,1,,,,,,,,4000000,,Immediate,,,,,,Common,Low,,
I002,I,Investment: Tech entrepreneur looking for tangible investments,Tech entrepreneur looking for tangible investments,"After years in the digital world, there's something appealing about bricks and mortar.",Self,Single,Any,,,Apply Investment,Permanent,,,,,,,,,,,,,,,,,,,1,1,,,,,,,,4500000,,Immediate,,,,,,Common,Low,,
I003,I,Investment: Family office interested in long-term stable returns,Family office interested in long-term stable returns,"Our wealth spans generations - so should our investments.",Self,Single,Any,,,Apply Investment,Permanent,,,,,,,,,,,,,,,,,,,1,1,,,,,,,,5000000,,Immediate,,,,,,Common,Low,,
I004,I,Investment: Private equity firm specializing in urban development,Private equity firm specializing in urban development,,Self,Single,Any,,,Apply Investment,Permanent,,,,,,,,,,,,,,,,,,,1,1,,,,,,,,5500000,,Immediate,,,,,,Common,Low,,
I005,I,Investment: Retired CEO investing personal wealth,Retired CEO investing personal wealth,,Self,Single,Any,,,Apply Investment,Permanent,,,,,,,,,,,,,,,,,,,1,1,,,,,,,,6000000,,Immediate,,,,,,Common,Low,,
I006,I,Investment: Foreign investment group exploring US market,Foreign investment group exploring US market,,Self,Single,Any,,,Apply Investment,Permanent,,,,,,,,,,,,,,,,,,,1,1,,,,,,,,6500000,,Immediate,,,,,,Common,Low,,
I007,I,Investment: Consortium of local businesses supporting community growth,Consortium of local businesses supporting community growth,,Self,Single,Any,,,Apply Investment,Permanent,,,,,,,,,,,,,,,,,,,1,1,,,,,,,,7000000,,Immediate,,,,,,Common,Low,,
I008,I,Investment: Green energy fund investing in sustainable projects,Green energy fund investing in sustainable projects,,Self,Single,Any,,,Apply Investment,Permanent,,,,,,,,,,,,,,,,,,,1,1,,,,,,,,7500000,,Immediate,,,,,,Common,Low,,
I009,I,Investment: Angel investor network pooling resources,Angel investor network pooling resources,,Self,Single,Any,,,Apply Investment,Permanent,,,,,,,,,,,,,,,,,,,1,1,,,,,,,,4000000,,Immediate,,,,,,Common,Low,,
I010,I,Investment: Hospitality chain expanding into new markets,Hospitality chain expanding into new markets,,Self,Single,Any,,,Apply Investment,Permanent,,,,,,,,,,,,,,,,,,,1,1,,,,,,,,4500000,,Immediate,,,,,,Common,Low,,
I011,I,Investment: Hedge fund diversifying into real estate,Hedge fund diversifying into real estate,,Self,Single,Any,,,Apply Investment,Permanent,,,,,,,,,,,,,,,,,,,1,1,,,,,,,,5000000,,Immediate,,,,,,Common,Low,,
I012,I,Investment: Philanthropic foundation with focus on urban renewal,Philanthropic foundation with focus on urban renewal,,Self,Single,Any,,,Apply Investment,Permanent,,,,,,,,,,,,,,,,,,,1,1,,,,,,,,5500000,,Immediate,,,,,,Common,Low,,
I013,I,Investment: Professional sports team owner branching into development,Professional sports team owner branching into development,,Self,Single,Any,,,Apply Investment,Permanent,,,,,,,,,,,,,,,,,,,1,1,,,,,,,,6000000,,Immediate,,,,,,Common,Low,,
I014,I,Investment: Celebrity entrepreneur building personal brand,Celebrity entrepreneur building personal brand,,Self,Single,Any,,,Apply Investment,Permanent,,,,,,,,,,,,,,,,,,,1,1,,,,,,,,6500000,,Immediate,,,,,,Common,Low,,
I015,I,Investment: Sovereign wealth fund seeking stable US investments,Sovereign wealth fund seeking stable US investments,,Self,Single,Any,,,Apply Investment,Permanent,,,,,,,,,,,,,,,,,,,1,1,,,,,,,,7000000,,Immediate,,,,,,Common,Low,,
I016,I,Investment: Healthcare REIT expanding portfolio,Healthcare REIT expanding portfolio,,Self,Single,Any,,,Apply Investment,Permanent,,,,,,,,,,,,,,,,,,,1,1,,,,,,,,7500000,,Immediate,,,,,,Common,Low,,
I017,I,Investment: Crowdfunding platform aggregating small investors,Crowdfunding platform aggregating small investors,,Self,Single,Any,,,Apply Investment,Permanent,,,,,,,,,,,,,,,,,,,1,1,,,,,,,,4000000,,Immediate,,,,,,Common,Low,,
I018,I,Investment: University endowment fund diversifying investments,University endowment fund diversifying investments,,Self,Single,Any,,,Apply Investment,Permanent,,,,,,,,,,,,,,,,,,,1,1,,,,,,,,4500000,,Immediate,,,,,,Common,Low,,
I019,I,Investment: Insurance company investing surplus funds,Insurance company investing surplus funds,,Self,Single,Any,,,Apply Investment,Permanent,,,,,,,,,,,,,,,,,,,1,1,,,,,,,,5000000,,Immediate,,,,,,Common,Low,,
I020,I,Investment: Venture capital firm exploring built environment tech,Venture capital firm exploring built environment tech,,Self,Single,Any,,,Apply Investment,Permanent,,,,,,,,,,,,,,,,,,,1,1,,,,,,,,5500000,,Immediate,,,,,,Common,Low,,
I021,I,Investment: Major bank's real estate investment arm,Major bank's real estate investment arm,,Self,Single,Any,,,Apply Investment,Permanent,,,,,,,,,,,,,,,,,,,1,1,,,,,,,,8000000,,Immediate,,,,,,Common,Medium,,
I022,I,Investment: International construction conglomerate,International construction conglomerate,,Self,Single,Any,,,Apply Investment,Permanent,,,,,,,,,,,,,,,,,,,1,1,,,,,,,,8500000,,Immediate,,,,,,Common,Medium,,
I023,I,Investment: Tech giant investing in smart city initiatives,Tech giant investing in smart city initiatives,,Self,Single,Any,,,Apply Investment,Permanent,,,,,,,,,,,,,,,,,,,1,1,,,,,,,,9000000,,Immediate,,,,,,Common,Medium,,
I024,I,Investment: National pension fund seeking long-term stable returns,National pension fund seeking long-term stable returns,,Self,Single,Any,,,Apply Investment,Permanent,,,,,,,,,,,,,,,,,,,1,1,,,,,,,,9500000,,Immediate,,,,,,Common,Medium,,
I025,I,Investment: Luxury goods company expanding into branded residences,Luxury goods company expanding into branded residences,,Self,Single,Any,,,Apply Investment,Permanent,,,,,,,,,,,,,,,,,,,1,1,,,,,,,,10000000,,Immediate,,,,,,Common,Medium,,
I026,I,Investment: Energy company diversifying into real estate,Energy company diversifying into real estate,,Self,Single,Any,,,Apply Investment,Permanent,,,,,,,,,,,,,,,,,,,1,1,,,,,,,,8000000,,Immediate,,,,,,Common,Medium,,
I027,I,Investment: Automotive manufacturer investing in future mobility hubs,Automotive manufacturer investing in future mobility hubs,,Self,Single,Any,,,Apply Investment,Permanent,,,,,,,,,,,,,,,,,,,1,1,,,,,,,,8500000,,Immediate,,,,,,Common,Medium,,
I028,I,Investment: Media conglomerate creating entertainment districts,Media conglomerate creating entertainment districts,,Self,Single,Any,,,Apply Investment,Permanent,,,,,,,,,,,,,,,,,,,1,1,,,,,,,,9000000,,Immediate,,,,,,Common,Medium,,
I029,I,Investment: Aerospace company developing vertiport infrastructure,Aerospace company developing vertiport infrastructure,,Self,Single,Any,,,Apply Investment,Permanent,,,,,,,,,,,,,,,,,,,1,1,,,,,,,,9500000,,Immediate,,,,,,Common,Medium,,
I030,I,Investment: E-commerce giant investing in logistics real estate,E-commerce giant investing in logistics real estate,,Self,Single,Any,,,Apply Investment,Permanent,,,,,,,,,,,,,,,,,,,1,1,,,,,,,,10000000,,Immediate,,,,,,Common,Medium,,
I031,I,Investment: Global hotel chain funding mixed-use developments,Global hotel chain funding mixed-use developments,,Self,Single,Any,,,Apply Investment,Permanent,,,,,,,,,,,,,,,,,,,1,1,,,,,,,,8000000,,Immediate,,,,,,Common,Medium,,
I032,I,Investment: Social media company creating collaborative workspaces,Social media company creating collaborative workspaces,,Self,Single,Any,,,Apply Investment,Permanent,,,,,,,,,,,,,,,,,,,1,1,,,,,,,,8500000,,Immediate,,,,,,Common,Medium,,
I033,I,Investment: Major league sports association developing sports districts,Major league sports association developing sports districts,,Self,Single,Any,,,Apply Investment,Permanent,,,,,,,,,,,,,,,,,,,1,1,,,,,,,,10500000,,Immediate,,,,,,Common,High,,
I034,I,Investment: Global investment bank's real estate fund,Global investment bank's real estate fund,,Self,Single,Any,,,Apply Investment,Permanent,,,,,,,,,,,,,,,,,,,1,1,,,,,,,,11000000,,Immediate,,,,,,Common,High,,
I035,I,Investment: International airport operator expanding commercial holdings,International airport operator expanding commercial holdings,,Self,Single,Any,,,Apply Investment,Permanent,,,,,,,,,,,,,,,,,,,1,1,,,,,,,,11500000,,Immediate,,,,,,Common,High,,
I036,I,Investment: Multinational tech consortium building smart city,Multinational tech consortium building smart city,,Self,Single,Any,,,Apply Investment,Permanent,,,,,,,,,,,,,,,,,,,1,1,,,,,,,,12000000,,Immediate,,,,,,Common,High,,
I037,I,Investment: National railway company developing transit-oriented projects,National railway company developing transit-oriented projects,,Self,Single,Any,,,Apply Investment,Permanent,,,,,,,,,,,,,,,,,,,1,1,,,,,,,,10500000,,Immediate,,,,,,Common,High,,
I038,I,Investment: Global theme park operator expanding into urban entertainment,Global theme park operator expanding into urban entertainment,,Self,Single,Any,,,Apply Investment,Permanent,,,,,,,,,,,,,,,,,,,1,1,,,,,,,,11000000,,Immediate,,,,,,Common,High,,
I039,I,Investment: International expo committee funding legacy project,International expo committee funding legacy project,,Self,Single,Any,,,Apply Investment,Permanent,,,,,,,,,,,,,,,,,,,1,1,,,,,,,,11500000,,Immediate,,,,,,Common,High,,
L001,L,Neighborly Complaints,The next inspection takes 3 additional ticks.,Nearby residents voice concerns about noise and dust prompting more thorough inspections.,Self,Single,CONSTRUCTION,,,Apply Card,Immediate,,,,,,3,,,,,,,,,,,,,1,1,,,,,,,,,,Immediate,,,,,,Common,Low,,
L002,L,Economic Downturn,All permit and inspection times increase by 2 ticks for the next 3 turns.,A slowdown in the economy leads to budget cuts and staffing shortages at the permit office.,All Players,Global,Any,,,Apply Card,Turns,3,,,,,2,,,,,,,,,,,,,1,1,,,,,,,,,,Immediate,,,,,,Common,Low,,
L003,L,New Safety Regulations,All players must discard 1 Expeditor card. All inspections take 3 additional ticks this turn.,Stricter safety rules require expeditors to update their filings and prepare for lengthier inspections.,All Players,Global,CONSTRUCTION,,,Apply Card,Immediate,,,,,,3,,,,,,1,,E,,,,,1,1,,,,,,,,,,Immediate,,,,,,Common,Low,,
L004,L,Labor Strike,All construction times increase by 4 ticks for the next 2 turns.,A strike by construction workers leads to significant project delays.,All Players,Global,Any,,,Apply Card,Turns,2,,,,,4,,,,,,,,,,,,,1,1,,,,,,,,,,Immediate,,,,,,Common,Low,,
L005,L,Positive Press,The current high-profile client filing takes 3 ticks less time. Draw 1 Expeditor Card.,Favorable media coverage puts pressure on officials to approve a noteworthy project quickly.,Self,Single,Any,,,Apply Card,Immediate,,,,,,-3,,,,,,1,,E,,,,,1,1,,,,,,,,,,Immediate,,,,,,Common,Low,,
L006,L,Unexpected Archeological Find,If a filing involves excavation increase its time by 6 ticks.,The discovery of archeological artifacts during excavation necessitates a lengthy review process.,Self,Single,Any,,,Apply Card,Immediate,,,,,,6,,,,,,,,,,,,,1,1,,,,,,,,,,Immediate,,,,,,Common,Low,,
L007,L,Zoning Variance Required,The current filing takes 4 ticks more time. Draw 1 Expeditor Card.,The project requires a zoning variance adding an extra layer of bureaucracy.,Self,Single,Any,,,Apply Card,Immediate,,,,,,4,,,,,,1,,E,,,,,1,1,,,,,,,,,,Immediate,,,,,,Common,Low,,
L008,L,Materials Shortage,All players' current construction phase takes 3 ticks more time.,A shortage of key building materials slows down construction across the city.,All Players,Global,CONSTRUCTION,,,Apply Card,Immediate,,,,,,3,,,,,,,,,,,,,1,1,,,,,,,,,,Immediate,,,,,,Common,Low,,
L009,L,NIMBY Lawsuit,Roll a die. On 1-3 the project is high-profile; increase the current filing time by 5 ticks. On 4-6 no effect.,Not In My Back Yard activists file a lawsuit against the project causing potential delays.,Self,Single,Any,,,Apply Card,Immediate,,,,,,5,,,On Play,Roll die: 1-3 increase filing time by 5,,,,,,,,,1,1,,,,,,,,,,Immediate,,,,,,Common,Low,,
L010,L,City Council Allies,The current permit filing takes 2 ticks less time. Draw 1 Expeditor Card.,Supportive city council members use their influence to streamline the permit process.,Self,Single,Any,,,Apply Card,Immediate,,,,,,-2,,,,,,1,,E,,,,,1,1,,,,,,,,,,Immediate,,,,,,Common,Low,,
L011,L,Holiday Rush,All filing times increase by 2 ticks this turn.,Many clients want projects approved before the holidays overwhelming expeditors.,All Players,Global,Any,,,Apply Card,Immediate,,,,,,2,,,,,,,,,,,,,1,1,,,,,,,,,,Immediate,,,,,,Common,Low,,
L012,L,Soil Contamination,If the current project involves groundwork increase the filing time by 4 ticks.,The discovery of contaminated soil requires additional environmental studies.,Self,Single,Any,,,Apply Card,Immediate,,,,,,4,,,,,,,,,,,,,1,1,,,,,,,,,,Immediate,,,,,,Common,Low,,
